url,name,about,ingredients,clean_about,clean_ingredients,clean_name,category,skin_type,combined_text
https://www.wardahbeauty.com/id/product/skincare/symradiance399-10-niacinamide-bright-barrier-repair-serum?ref=https://www.wardahbeauty.com/id/product/list/skincare?page=1,SYMRADIANCE399 + 10% NIACINAMIDE BRIGHT & BARRIER REPAIR SERUM,"Wardah SymRadiance399 + 10% Niacinamide Bright & Barrier Repair Serum adalah serum pencerah intensif yang menyamarkan bekas jerawat, meratakan warna kulit, dan menjaga skin barrier tetap sehat. Teksturnya ringan, cepat meresap, dan memberikan hidrasi tanpa rasa lengket. Diformulasikan dengan SymRadiance399, 2x lebih efektif untuk mencerahkan, serta 10% Niacinamide ADV yang menargetkan 2x lebih banyak sel untuk memudarkan noda dan meratakan kulit. Sodium Hyaluronate menjaga kelembapan dan memperhalus tekstur, sementara Bisabolol sebagai super antioksidan melindungi kulit dari kekusaman. Gunakan pagi dan malam setelah mencuci wajah. Aplikasikan beberapa tetes, pijat lembut, lalu lanjutkan dengan pelembap. Maksimalkan dengan rangkaian skincare Wardah lainnya!","SymRadiance399 Generasi terbaru dari SymWhite 377, 2x lebih efektif mencerahkan kulit dan mengurangi hiperpigmentasi. 10% Niacinamide ADV Menargetkan 2x lebih banyak sel untuk memudarkan noda bekas jerawat dan meratakan warna kulit. Sodium Hyaluronate Menjaga kelembapan kulit, meningkatkan elastisitas, dan memperhalus tekstur kulit. Bisabolol Super antioksidan yang membantu mencegah kulit kusam dan memperkuat skin barrier agar tetap sehat dan terlindungi.",wardah symradiance niacinamide bright barrier repair serum adalah serum pencerah intensif yang menyamarkan bekas jerawat meratakan warna kulit dan menjaga skin barrier tetap sehat teksturnya ringan cepat meresap dan memberikan hidrasi tanpa rasa lengket diformulasikan dengan symradiance x lebih efektif untuk mencerahkan serta niacinamide adv yang menargetkan x lebih banyak sel untuk memudarkan noda dan meratakan kulit sodium hyaluronate menjaga kelembapan dan memperhalus tekstur sementara bisabolol sebagai super antioksidan melindungi kulit dari kekusaman gunakan pagi dan malam setelah mencuci wajah aplikasikan beberapa tetes pijat lembut lalu lanjutkan dengan pelembap maksimalkan dengan rangkaian skincare wardah lainnya,symradiance generasi terbaru dari symwhite x lebih efektif mencerahkan kulit dan mengurangi hiperpigmentasi niacinamide adv menargetkan x lebih banyak sel untuk memudarkan noda bekas jerawat dan meratakan warna kulit sodium hyaluronate menjaga kelembapan kulit meningkatkan elastisitas dan memperhalus tekstur kulit bisabolol super antioksidan yang membantu mencegah kulit kusam dan memperkuat skin barrier agar tetap sehat dan terlindungi,symradiance399 10% niacinamide bright barrier repair serum,['serum'],['all skin types'],symradiance399 10% niacinamide bright barrier repair serum serum all skin types wardah symradiance niacinamide bright barrier repair serum adalah serum pencerah intensif yang menyamarkan bekas jerawat meratakan warna kulit dan menjaga skin barrier tetap sehat teksturnya ringan cepat meresap dan memberikan hidrasi tanpa rasa lengket diformulasikan dengan symradiance x lebih efektif untuk mencerahkan serta niacinamide adv yang menargetkan x lebih banyak sel untuk memudarkan noda dan meratakan kulit sodium hyaluronate menjaga kelembapan dan memperhalus tekstur sementara bisabolol sebagai super antioksidan melindungi kulit dari kekusaman gunakan pagi dan malam setelah mencuci wajah aplikasikan beberapa tetes pijat lembut lalu lanjutkan dengan pelembap maksimalkan dengan rangkaian skincare wardah lainnya symradiance generasi terbaru dari symwhite x lebih efektif mencerahkan kulit dan mengurangi hiperpigmentasi niacinamide adv menargetkan x lebih banyak sel untuk memudarkan noda bekas jerawat dan meratakan warna kulit sodium hyaluronate menjaga kelembapan kulit meningkatkan elastisitas dan memperhalus tekstur kulit bisabolol super antioksidan yang membantu mencegah kulit kusam dan memperkuat skin barrier agar tetap sehat dan terlindungi
https://www.wardahbeauty.com/id/product/skincare/symradiance399-5-niacinamide-bright-barrier-booster-moisture-gel?ref=https://www.wardahbeauty.com/id/product/list/skincare?page=1,SYMRADIANCE399 + 5% NIACINAMIDE BRIGHT & BARRIER BOOSTER MOISTURE GEL,"Wardah SymRadiance399 + 5% Niacinamide Bright & Barrier Booster Moisture Gel adalah pelembap ringan yang tak hanya mencerahkan, tapi juga memperkuat skin barrier. Dengan tekstur cepat meresap, kulit tetap terhidrasi, tampak lebih cerah, dan bebas kusam tanpa rasa lengket. Diperkaya SymRadiance399, generasi terbaru SymWhite 377 yang 2x lebih efektif mencerahkan, serta 5% Niacinamide ADV dengan penetrasi 8x lebih dalam untuk meratakan warna kulit. Licorice bekerja sinergis untuk menyamarkan noda, sementara Allantoin menenangkan dan melindungi kulit dari iritasi. Gunakan pagi dan malam pada wajah bersih, pijat lembut hingga meresap. Untuk hasil terbaik, padukan dengan rangkaian skincare Wardah lainnya!","SymRadiance399 Generasi terbaru dari SymWhite 377, 2x lebih efektif dalam mencerahkan kulit dan mengurangi hiperpigmentasi. 5% Niacinamide ADV Teknologi canggih dengan 8x lebih dalam penetrasi untuk mencerahkan, meratakan warna kulit, dan memperbaiki tekstur. Licorice Extract Bekerja sinergis dengan SymRadiance399 & Niacinamide ADV untuk menyamarkan noda bekas jerawat dan mencerahkan kulit. Allantoin Menenangkan kulit, mengurangi iritasi, serta bertindak sebagai agen pelindung skin barrier untuk menjaga kelembapan dan kesehatan kulit.",wardah symradiance niacinamide bright barrier booster moisture gel adalah pelembap ringan yang tak hanya mencerahkan tapi juga memperkuat skin barrier dengan tekstur cepat meresap kulit tetap terhidrasi tampak lebih cerah dan bebas kusam tanpa rasa lengket diperkaya symradiance generasi terbaru symwhite yang x lebih efektif mencerahkan serta niacinamide adv dengan penetrasi x lebih dalam untuk meratakan warna kulit licorice bekerja sinergis untuk menyamarkan noda sementara allantoin menenangkan dan melindungi kulit dari iritasi gunakan pagi dan malam pada wajah bersih pijat lembut hingga meresap untuk hasil terbaik padukan dengan rangkaian skincare wardah lainnya,symradiance generasi terbaru dari symwhite x lebih efektif dalam mencerahkan kulit dan mengurangi hiperpigmentasi niacinamide adv teknologi canggih dengan x lebih dalam penetrasi untuk mencerahkan meratakan warna kulit dan memperbaiki tekstur licorice extract bekerja sinergis dengan symradiance niacinamide adv untuk menyamarkan noda bekas jerawat dan mencerahkan kulit allantoin menenangkan kulit mengurangi iritasi serta bertindak sebagai agen pelindung skin barrier untuk menjaga kelembapan dan kesehatan kulit,symradiance399 5% niacinamide bright barrier booster moisture gel,['moisturizer'],"['all skin types', 'dry']",symradiance399 5% niacinamide bright barrier booster moisture gel moisturizer all skin types dry wardah symradiance niacinamide bright barrier booster moisture gel adalah pelembap ringan yang tak hanya mencerahkan tapi juga memperkuat skin barrier dengan tekstur cepat meresap kulit tetap terhidrasi tampak lebih cerah dan bebas kusam tanpa rasa lengket diperkaya symradiance generasi terbaru symwhite yang x lebih efektif mencerahkan serta niacinamide adv dengan penetrasi x lebih dalam untuk meratakan warna kulit licorice bekerja sinergis untuk menyamarkan noda sementara allantoin menenangkan dan melindungi kulit dari iritasi gunakan pagi dan malam pada wajah bersih pijat lembut hingga meresap untuk hasil terbaik padukan dengan rangkaian skincare wardah lainnya symradiance generasi terbaru dari symwhite x lebih efektif dalam mencerahkan kulit dan mengurangi hiperpigmentasi niacinamide adv teknologi canggih dengan x lebih dalam penetrasi untuk mencerahkan meratakan warna kulit dan memperbaiki tekstur licorice extract bekerja sinergis dengan symradiance niacinamide adv untuk menyamarkan noda bekas jerawat dan mencerahkan kulit allantoin menenangkan kulit mengurangi iritasi serta bertindak sebagai agen pelindung skin barrier untuk menjaga kelembapan dan kesehatan kulit
https://www.wardahbeauty.com/id/product/skincare/perfect-bright-pore-perfecting-c-glow-serum?ref=https://www.wardahbeauty.com/id/product/list/skincare?page=1,PERFECT BRIGHT PORE PERFECTING C-GLOW SERUM,"Wardah Perfect Bright Pore Perfecting C-Glow Serum adalah solusi canggih untuk kulit cerah, halus, dan bebas kilap. Diperkaya dengan kandungan unggulan Perfectyl, serum ini membantu menyempurnakan tampilan kulit dengan mengecilkan tampilan pori-pori sekaligus menjaga elastisitasnya. Kandungan 1% Vitamin C di dalamnya bekerja aktif sebagai antioksidan yang mencerahkan kulit secara merata, melawan efek radikal bebas, dan memberikan kilau alami yang sehat. Dengan tambahan 5% Niacinamide, produk ini tidak hanya mencerahkan tetapi juga menghidrasi dan memperkuat skin barrier untuk perlindungan ekstra dari faktor eksternal. Keunggulan serum ini tidak hanya berhenti pada efek mencerahkan. Formula khususnya membantu mengontrol produksi sebum berlebih, menjadikan kulit terasa lebih segar tanpa rasa berminyak sepanjang hari. Penggunaan rutin Wardah Perfect Bright Pore Perfecting C-Glow Serum juga efektif untuk menyamarkan pori-pori, membuat tekstur kulit terlihat lebih halus dan terasa lebih lembut. Dengan tekstur ringan yang cepat meresap, serum ini cocok untuk semua jenis kulit, termasuk kulit berminyak dan sensitif. Untuk hasil terbaik, gunakan serum ini pada pagi dan malam hari. Cukup aplikasikan 1-2 tetes ke telapak tangan, lalu pijat lembut ke seluruh wajah yang telah dibersihkan. Pastikan untuk menggunakan pelembap setelahnya dan sunscreen di pagi hari untuk perlindungan maksimal. Dengan Wardah Perfect Bright Pore Perfecting C-Glow Serum, kulit cerah, halus, dan sehat kini bukan lagi impian!",Perfectyl: Mengecilkan tampilan pori-pori sehingga kulit tampak halus dalam 14 hari 1% Vitamin C: Antioksidan yang bantu mencerahkan kulit & melindungi kulit dari polusi & radikal bebas 5% Niacinamide: Bekerja sinergis dengan vitamin c untuk mencerahkan kulit + mengurangi minyak berlebih,wardah perfect bright pore perfecting c glow serum adalah solusi canggih untuk kulit cerah halus dan bebas kilap diperkaya dengan kandungan unggulan perfectyl serum ini membantu menyempurnakan tampilan kulit dengan mengecilkan tampilan pori pori sekaligus menjaga elastisitasnya kandungan vitamin c di dalamnya bekerja aktif sebagai antioksidan yang mencerahkan kulit secara merata melawan efek radikal bebas dan memberikan kilau alami yang sehat dengan tambahan niacinamide produk ini tidak hanya mencerahkan tetapi juga menghidrasi dan memperkuat skin barrier untuk perlindungan ekstra dari faktor eksternal keunggulan serum ini tidak hanya berhenti pada efek mencerahkan formula khususnya membantu mengontrol produksi sebum berlebih menjadikan kulit terasa lebih segar tanpa rasa berminyak sepanjang hari penggunaan rutin wardah perfect bright pore perfecting c glow serum juga efektif untuk menyamarkan pori pori membuat tekstur kulit terlihat lebih halus dan terasa lebih lembut dengan tekstur ringan yang cepat meresap serum ini cocok untuk semua jenis kulit termasuk kulit berminyak dan sensitif untuk hasil terbaik gunakan serum ini pada pagi dan malam hari cukup aplikasikan tetes ke telapak tangan lalu pijat lembut ke seluruh wajah yang telah dibersihkan pastikan untuk menggunakan pelembap setelahnya dan sunscreen di pagi hari untuk perlindungan maksimal dengan wardah perfect bright pore perfecting c glow serum kulit cerah halus dan sehat kini bukan lagi impian,perfectyl mengecilkan tampilan pori pori sehingga kulit tampak halus dalam hari vitamin c antioksidan yang bantu mencerahkan kulit melindungi kulit dari polusi radikal bebas niacinamide bekerja sinergis dengan vitamin c untuk mencerahkan kulit mengurangi minyak berlebih,perfect bright pore perfecting c glow serum,"['serum', 'sunscreen']","['all skin types', 'combination', 'oily']",perfect bright pore perfecting c glow serum serum sunscreen all skin types combination oily wardah perfect bright pore perfecting c glow serum adalah solusi canggih untuk kulit cerah halus dan bebas kilap diperkaya dengan kandungan unggulan perfectyl serum ini membantu menyempurnakan tampilan kulit dengan mengecilkan tampilan pori pori sekaligus menjaga elastisitasnya kandungan vitamin c di dalamnya bekerja aktif sebagai antioksidan yang mencerahkan kulit secara merata melawan efek radikal bebas dan memberikan kilau alami yang sehat dengan tambahan niacinamide produk ini tidak hanya mencerahkan tetapi juga menghidrasi dan memperkuat skin barrier untuk perlindungan ekstra dari faktor eksternal keunggulan serum ini tidak hanya berhenti pada efek mencerahkan formula khususnya membantu mengontrol produksi sebum berlebih menjadikan kulit terasa lebih segar tanpa rasa berminyak sepanjang hari penggunaan rutin wardah perfect bright pore perfecting c glow serum juga efektif untuk menyamarkan pori pori membuat tekstur kulit terlihat lebih halus dan terasa lebih lembut dengan tekstur ringan yang cepat meresap serum ini cocok untuk semua jenis kulit termasuk kulit berminyak dan sensitif untuk hasil terbaik gunakan serum ini pada pagi dan malam hari cukup aplikasikan tetes ke telapak tangan lalu pijat lembut ke seluruh wajah yang telah dibersihkan pastikan untuk menggunakan pelembap setelahnya dan sunscreen di pagi hari untuk perlindungan maksimal dengan wardah perfect bright pore perfecting c glow serum kulit cerah halus dan sehat kini bukan lagi impian perfectyl mengecilkan tampilan pori pori sehingga kulit tampak halus dalam hari vitamin c antioksidan yang bantu mencerahkan kulit melindungi kulit dari polusi radikal bebas niacinamide bekerja sinergis dengan vitamin c untuk mencerahkan kulit mengurangi minyak berlebih
https://www.wardahbeauty.com/id/product/skincare/wardah-micro-peeling-serum?ref=https://www.wardahbeauty.com/id/product/list/skincare?page=1,WARDAH MICRO PEELING SERUM,"Wardah Micropeeling Serum adalah solusi untuk kulit cerah dan halus, diformulasikan dengan perpaduan eksfoliator lembut yang efektif. Kandungan 5% Glycolic Acid bekerja mengangkat sel-sel kulit mati secara mendalam, 3% Maltobionic Acid Eksfoliator lembut yang membantu mengungkapkan kulit baru tanpa membuat kulit kering atau merusak skin barrier, serta 2% Succinic Acid Membantu mengatur produksi sebum pada kulit, sehingga dapat mengurangi tampilan pori-pori dan mencegah terbentuknya komedo hitam (blackheads). Kombinasi bahan aktif ini membuat kulit terasa lebih lembut, bercahaya, dan tampak lebih sehat tanpa menyebabkan iritasi berlebihan. Serum ini dirancang khusus untuk membantu proses regenerasi kulit secara lembut di malam hari. Dengan eksfoliator ringan, kulit tampak lebih cerah, tekstur kulit lebih rata, dan noda hitam memudar secara bertahap. Formulanya yang aman dan efektif cocok untuk semua jenis kulit. Untuk pemakaian, gunakan pada malam hari setelah wajah dibersihkan. Bagi pemula, aplikasikan tipis-tipis dan biarkan selama beberapa menit sebelum dibilas untuk membiasakan kulit. Setelah kulit beradaptasi, serum ini dapat digunakan sepanjang malam tanpa perlu dibilas untuk hasil maksimal. Hindari area sekitar mata dan selalu gunakan sunscreen di pagi hari setelah pemakaian. Dengan Wardah Micropeeling Serum, kulit Anda akan terasa lebih halus, bercahaya, dan siap menghadapi hari dengan percaya diri!","5% Glycolic Acid: Memberikan eksfoliasi mendalam untuk membantu mempercepat regenerasi kulit. Dengan mengangkat sel-sel kulit mati, bahan ini membuat kulit terasa lebih halus, cerah, dan merata. Cocok untuk meningkatkan tekstur dan warna kulit secara keseluruhan. 3% Maltobionic Acid: Eksfoliator lembut yang membantu mengungkapkan kulit baru tanpa membuat kulit kering atau merusak skin barrier. Kandungan ini memberikan hidrasi sekaligus merawat kulit agar tetap sehat dan terjaga kelembapannya. 2% Succinic Acid: Membantu mengatur produksi sebum pada kulit, sehingga dapat mengurangi tampilan pori-pori dan mencegah terbentuknya komedo hitam (blackheads). Bahan ini memberikan keseimbangan bagi kulit berminyak atau rentan berjerawat. Vitamin B12: Berfungsi untuk menenangkan kulit yang mengalami kemerahan atau rasa perih akibat proses eksfoliasi. Bahan ini memberikan efek menenangkan dan membantu menjaga kenyamanan kulit selama pemakaian.",wardah micropeeling serum adalah solusi untuk kulit cerah dan halus diformulasikan dengan perpaduan eksfoliator lembut yang efektif kandungan glycolic acid bekerja mengangkat sel sel kulit mati secara mendalam maltobionic acid eksfoliator lembut yang membantu mengungkapkan kulit baru tanpa membuat kulit kering atau merusak skin barrier serta succinic acid membantu mengatur produksi sebum pada kulit sehingga dapat mengurangi tampilan pori pori dan mencegah terbentuknya komedo hitam blackheads kombinasi bahan aktif ini membuat kulit terasa lebih lembut bercahaya dan tampak lebih sehat tanpa menyebabkan iritasi berlebihan serum ini dirancang khusus untuk membantu proses regenerasi kulit secara lembut di malam hari dengan eksfoliator ringan kulit tampak lebih cerah tekstur kulit lebih rata dan noda hitam memudar secara bertahap formulanya yang aman dan efektif cocok untuk semua jenis kulit untuk pemakaian gunakan pada malam hari setelah wajah dibersihkan bagi pemula aplikasikan tipis tipis dan biarkan selama beberapa menit sebelum dibilas untuk membiasakan kulit setelah kulit beradaptasi serum ini dapat digunakan sepanjang malam tanpa perlu dibilas untuk hasil maksimal hindari area sekitar mata dan selalu gunakan sunscreen di pagi hari setelah pemakaian dengan wardah micropeeling serum kulit anda akan terasa lebih halus bercahaya dan siap menghadapi hari dengan percaya diri,glycolic acid memberikan eksfoliasi mendalam untuk membantu mempercepat regenerasi kulit dengan mengangkat sel sel kulit mati bahan ini membuat kulit terasa lebih halus cerah dan merata cocok untuk meningkatkan tekstur dan warna kulit secara keseluruhan maltobionic acid eksfoliator lembut yang membantu mengungkapkan kulit baru tanpa membuat kulit kering atau merusak skin barrier kandungan ini memberikan hidrasi sekaligus merawat kulit agar tetap sehat dan terjaga kelembapannya succinic acid membantu mengatur produksi sebum pada kulit sehingga dapat mengurangi tampilan pori pori dan mencegah terbentuknya komedo hitam blackheads bahan ini memberikan keseimbangan bagi kulit berminyak atau rentan berjerawat vitamin b berfungsi untuk menenangkan kulit yang mengalami kemerahan atau rasa perih akibat proses eksfoliasi bahan ini memberikan efek menenangkan dan membantu menjaga kenyamanan kulit selama pemakaian,wardah micro peeling serum,"['serum', 'sunscreen']","['all skin types', 'combination', 'oily']",wardah micro peeling serum serum sunscreen all skin types combination oily wardah micropeeling serum adalah solusi untuk kulit cerah dan halus diformulasikan dengan perpaduan eksfoliator lembut yang efektif kandungan glycolic acid bekerja mengangkat sel sel kulit mati secara mendalam maltobionic acid eksfoliator lembut yang membantu mengungkapkan kulit baru tanpa membuat kulit kering atau merusak skin barrier serta succinic acid membantu mengatur produksi sebum pada kulit sehingga dapat mengurangi tampilan pori pori dan mencegah terbentuknya komedo hitam blackheads kombinasi bahan aktif ini membuat kulit terasa lebih lembut bercahaya dan tampak lebih sehat tanpa menyebabkan iritasi berlebihan serum ini dirancang khusus untuk membantu proses regenerasi kulit secara lembut di malam hari dengan eksfoliator ringan kulit tampak lebih cerah tekstur kulit lebih rata dan noda hitam memudar secara bertahap formulanya yang aman dan efektif cocok untuk semua jenis kulit untuk pemakaian gunakan pada malam hari setelah wajah dibersihkan bagi pemula aplikasikan tipis tipis dan biarkan selama beberapa menit sebelum dibilas untuk membiasakan kulit setelah kulit beradaptasi serum ini dapat digunakan sepanjang malam tanpa perlu dibilas untuk hasil maksimal hindari area sekitar mata dan selalu gunakan sunscreen di pagi hari setelah pemakaian dengan wardah micropeeling serum kulit anda akan terasa lebih halus bercahaya dan siap menghadapi hari dengan percaya diri glycolic acid memberikan eksfoliasi mendalam untuk membantu mempercepat regenerasi kulit dengan mengangkat sel sel kulit mati bahan ini membuat kulit terasa lebih halus cerah dan merata cocok untuk meningkatkan tekstur dan warna kulit secara keseluruhan maltobionic acid eksfoliator lembut yang membantu mengungkapkan kulit baru tanpa membuat kulit kering atau merusak skin barrier kandungan ini memberikan hidrasi sekaligus merawat kulit agar tetap sehat dan terjaga kelembapannya succinic acid membantu mengatur produksi sebum pada kulit sehingga dapat mengurangi tampilan pori pori dan mencegah terbentuknya komedo hitam blackheads bahan ini memberikan keseimbangan bagi kulit berminyak atau rentan berjerawat vitamin b berfungsi untuk menenangkan kulit yang mengalami kemerahan atau rasa perih akibat proses eksfoliasi bahan ini memberikan efek menenangkan dan membantu menjaga kenyamanan kulit selama pemakaian
https://www.wardahbeauty.com/id/product/skincare/uv-shield-tone-up-sunscreen-serum-spf-50-pa?ref=https://www.wardahbeauty.com/id/product/list/skincare?page=1,UV SHIELD TONE UP SUNSCREEN SERUM SPF 50 PA+++,"UV Shield Tone Up Suncreen Serum SPF 50 PA+++ adalah sunscreen yang di formulasikan with Color Correct Technology tidak hanya untuk melindungi tetapi dapat digunakan untuk tampilan riasan yang sempurna, Sunscreen SPF50 + Instant Tone Up Effect + Makeup Primer. Dilengkapi juga dengan Color Correct Formula untuk meratakan kulit secara instan serta Tranexamic dan Bright Peptide untuk mencerahkan kulit kusam & flek hitam. Memiliki texture yang ringan dan mudah diratakan da tidak meninggal kan white-cast.","Pencerah kulit: Asam Traneksamat Oligopeptida -68. Bahan yang identik dengan kulit : Gliserin. Menenangkan : Bisabolol, AllantoinAsam Traneksamat. Tabir surya : Etilheksil MetoksikinnamatSeng OksidaBis -Etilheksiloksifenol Metoksifenil Triazin, Dietilamino Hidroksibenzoil Heksil Benzoat, Titanium Dioksida",uv shield tone up suncreen serum spf pa adalah sunscreen yang di formulasikan with color correct technology tidak hanya untuk melindungi tetapi dapat digunakan untuk tampilan riasan yang sempurna sunscreen spf instant tone up effect makeup primer dilengkapi juga dengan color correct formula untuk meratakan kulit secara instan serta tranexamic dan bright peptide untuk mencerahkan kulit kusam flek hitam memiliki texture yang ringan dan mudah diratakan da tidak meninggal kan white cast,pencerah kulit asam traneksamat oligopeptida bahan yang identik dengan kulit gliserin menenangkan bisabolol allantoinasam traneksamat tabir surya etilheksil metoksikinnamatseng oksidabis etilheksiloksifenol metoksifenil triazin dietilamino hidroksibenzoil heksil benzoat titanium dioksida,uv shield tone up sunscreen serum spf 50 pa,"['serum', 'sunscreen']","['all skin types', 'combination', 'dry', 'sensitive']",uv shield tone up sunscreen serum spf 50 pa serum sunscreen all skin types combination dry sensitive uv shield tone up suncreen serum spf pa adalah sunscreen yang di formulasikan with color correct technology tidak hanya untuk melindungi tetapi dapat digunakan untuk tampilan riasan yang sempurna sunscreen spf instant tone up effect makeup primer dilengkapi juga dengan color correct formula untuk meratakan kulit secara instan serta tranexamic dan bright peptide untuk mencerahkan kulit kusam flek hitam memiliki texture yang ringan dan mudah diratakan da tidak meninggal kan white cast pencerah kulit asam traneksamat oligopeptida bahan yang identik dengan kulit gliserin menenangkan bisabolol allantoinasam traneksamat tabir surya etilheksil metoksikinnamatseng oksidabis etilheksiloksifenol metoksifenil triazin dietilamino hidroksibenzoil heksil benzoat titanium dioksida
