url,name,about,ingredients,clean_about,clean_ingredients,clean_name,category,skin_type,combined_text
https://www.wardahbeauty.com/id/product/skincare/c-defense-face-mist?ref=https://www.wardahbeauty.com/id/product/list/skincare/sort/c-defense?page=1,C-DEFENSE FACE MIST,Bangkitkan kembali semangat tangguhnya kulitmu dengan face mist yang praktis membuat kulitmu segar seketika. Kandungan Vitamin C dan Natural Moisturizing Factor membantu menjaga kelembaban kulit.,"HI-GRADE VITAMIN C, NATURAL MOISTURIZING FACTOR. Aqua, Trideceth-9, Sodium Ascorbyl Phosphate, Sodium PCA, PEG-40 Hydrogenated Castor Oil, Allantoin, Cetrimonium Bromide, Disodium EDTA, Fragrance, Polysorbate 20.",bangkitkan kembali semangat tangguhnya kulitmu dengan face mist yang praktis membuat kulitmu segar seketika kandungan vitamin c dan natural moisturizing factor membantu menjaga kelembaban kulit,hi grade vitamin c natural moisturizing factor aqua trideceth sodium ascorbyl phosphate sodium pca peg hydrogenated castor oil allantoin cetrimonium bromide disodium edta fragrance polysorbate,c defense face mist,['toner/essence'],"['all skin types', 'combination', 'dry']",c defense face mist toner/essence all skin types combination dry bangkitkan kembali semangat tangguhnya kulitmu dengan face mist yang praktis membuat kulitmu segar seketika kandungan vitamin c dan natural moisturizing factor membantu menjaga kelembaban kulit hi grade vitamin c natural moisturizing factor aqua trideceth sodium ascorbyl phosphate sodium pca peg hydrogenated castor oil allantoin cetrimonium bromide disodium edta fragrance polysorbate
https://www.wardahbeauty.com/id/product/skincare/c-defense-energizing-creamy-wash?ref=https://www.wardahbeauty.com/id/product/list/skincare/sort/c-defense?page=1,C-DEFENSE ENERGIZING CREAMY WASH,"Wardah C-defense Energizing Creamy Wash merupakan produk sabun pembersih wajah yang memberikan kesegaran dengan aroma jeruk yang fresh, busa creamy yang mengandung antioksidan Vitamin C dan mild surfactant yang berfungsi membersihkan dan menjaga kelembaban kulit.","Vitamin C (Sodium Ascorbyl Phosphate) sebagai antioksidan, Active Moist Complex (Glycerin, Panthenol), dan bahan pembersih lembut (mild surfactants) seperti Myristic Acid, Potassium Cocoyl Glycinate, serta ekstrak biji anggur (Vitis Vinifera Seed Extract)",wardah c defense energizing creamy wash merupakan produk sabun pembersih wajah yang memberikan kesegaran dengan aroma jeruk yang fresh busa creamy yang mengandung antioksidan vitamin c dan mild surfactant yang berfungsi membersihkan dan menjaga kelembaban kulit,vitamin c sodium ascorbyl phosphate sebagai antioksidan active moist complex glycerin panthenol dan bahan pembersih lembut mild surfactants seperti myristic acid potassium cocoyl glycinate serta ekstrak biji anggur vitis vinifera seed extract,c defense energizing creamy wash,['face wash'],"['all skin types', 'combination']",c defense energizing creamy wash face wash all skin types combination wardah c defense energizing creamy wash merupakan produk sabun pembersih wajah yang memberikan kesegaran dengan aroma jeruk yang fresh busa creamy yang mengandung antioksidan vitamin c dan mild surfactant yang berfungsi membersihkan dan menjaga kelembaban kulit vitamin c sodium ascorbyl phosphate sebagai antioksidan active moist complex glycerin panthenol dan bahan pembersih lembut mild surfactants seperti myristic acid potassium cocoyl glycinate serta ekstrak biji anggur vitis vinifera seed extract
https://www.wardahbeauty.com/id/product/skincare/acnederm-acne-care-micellar-water?ref=https://www.wardahbeauty.com/id/product/list/skincare/sort/acnederm?page=1,ACNEDERM ACNE CARE MICELLAR WATER,"Acnederm Acne Care Micellar Water with 3 POWERFUL ACTIONS yang membersihkan kulit berminyak dan berjerawat hingga ke pori-pori dengan lembut, mengurangi tanda jerawat, serta menjaga skin barrier. Dilengkapi dengan Salicylic Acid, Ceramide, dan Biosaccharide membersihkan","SALICYLIC ACID Mencegah timbulnya jerawat & meredakan kemerahan CERAMIDE Menenangkan, menjaga elastisitas dan kekencangan kulit BIOSACCHARIDE Cegah inflamasi dan kemerahan",acnederm acne care micellar water with powerful actions yang membersihkan kulit berminyak dan berjerawat hingga ke pori pori dengan lembut mengurangi tanda jerawat serta menjaga skin barrier dilengkapi dengan salicylic acid ceramide dan biosaccharide membersihkan,salicylic acid mencegah timbulnya jerawat meredakan kemerahan ceramide menenangkan menjaga elastisitas dan kekencangan kulit biosaccharide cegah inflamasi dan kemerahan,acnederm acne care micellar water,['cleanser'],"['acne-prone', 'all skin types', 'combination', 'dry']",acnederm acne care micellar water cleanser acne-prone all skin types combination dry acnederm acne care micellar water with powerful actions yang membersihkan kulit berminyak dan berjerawat hingga ke pori pori dengan lembut mengurangi tanda jerawat serta menjaga skin barrier dilengkapi dengan salicylic acid ceramide dan biosaccharide membersihkan salicylic acid mencegah timbulnya jerawat meredakan kemerahan ceramide menenangkan menjaga elastisitas dan kekencangan kulit biosaccharide cegah inflamasi dan kemerahan
https://www.wardahbeauty.com/id/product/skincare/acnederm-acne-care-serum?ref=https://www.wardahbeauty.com/id/product/list/skincare/sort/acnederm?page=1,ACNEDERM ACNE CARE SERUM,"Serum multifungsi bertekstur ringan dengan kombinasi bahan aktif 5% Azeclair™?, 0.5% Salicylic Acid, dan Tea Tree Oil yang diformulasikan untuk kulit berjerawat.","Azeclair™, Salicylic Acid, Hyaluronic Acid, Allantoin",serum multifungsi bertekstur ringan dengan kombinasi bahan aktif azeclair salicylic acid dan tea tree oil yang diformulasikan untuk kulit berjerawat,azeclair salicylic acid hyaluronic acid allantoin,acnederm acne care serum,['serum'],"['acne-prone', 'all skin types', 'combination', 'dry']",acnederm acne care serum serum acne-prone all skin types combination dry serum multifungsi bertekstur ringan dengan kombinasi bahan aktif azeclair salicylic acid dan tea tree oil yang diformulasikan untuk kulit berjerawat azeclair salicylic acid hyaluronic acid allantoin
https://www.wardahbeauty.com/id/product/skincare/wardah-acnederm-acne-spot-treatment-gel?ref=https://www.wardahbeauty.com/id/product/list/skincare/sort/acnederm?page=1,ACNEDERM ACNE SPOT TREATMENT GEL,Wardah Acnederm Acne Spot Treatment Gel bantu atasi masalah jerawat di wajah dengan kandungan Derma Treat Actives dengan BHA & Willowherb Extract.,"Aqua, Propylene Glycol, Salicylic Acid, Polyacrylate Crosspolymer-6, Xanthan Gum, Amylopectin, Dextrin, Phenoxyethanol, Capryloyl Glycine, Hexylene Glycol, Butylene Glycol, Sarcosine, Disodium EDTA, Ethylhexylglycerin, Cinnamomum Zeylanicum Bark Extract, Epilobium Angustifolium Extract, Centella Asiatica Extract, Sodium Citrate, Phragmites Kharka Extract, Poria Cocos Extract, Polygonum Cuspidatum Root Extract, Scutellaria Baicalensis Root Extract, Citric Acid, Sodium Benzoate, Camellia Sinensis Leaf Extract, Licorice Root Extract, Chamomilla Recutita Flower Extract, Rosemary Leaf Extract, Sodium Metabisulfite",wardah acnederm acne spot treatment gel bantu atasi masalah jerawat di wajah dengan kandungan derma treat actives dengan bha willowherb extract,aqua propylene glycol salicylic acid polyacrylate crosspolymer xanthan gum amylopectin dextrin phenoxyethanol capryloyl glycine hexylene glycol butylene glycol sarcosine disodium edta ethylhexylglycerin cinnamomum zeylanicum bark extract epilobium angustifolium extract centella asiatica extract sodium citrate phragmites kharka extract poria cocos extract polygonum cuspidatum root extract scutellaria baicalensis root extract citric acid sodium benzoate camellia sinensis leaf extract licorice root extract chamomilla recutita flower extract rosemary leaf extract sodium metabisulfite,acnederm acne spot treatment gel,['treatment'],"['acne-prone', 'all skin types', 'combination', 'sensitive']",acnederm acne spot treatment gel treatment acne-prone all skin types combination sensitive wardah acnederm acne spot treatment gel bantu atasi masalah jerawat di wajah dengan kandungan derma treat actives dengan bha willowherb extract aqua propylene glycol salicylic acid polyacrylate crosspolymer xanthan gum amylopectin dextrin phenoxyethanol capryloyl glycine hexylene glycol butylene glycol sarcosine disodium edta ethylhexylglycerin cinnamomum zeylanicum bark extract epilobium angustifolium extract centella asiatica extract sodium citrate phragmites kharka extract poria cocos extract polygonum cuspidatum root extract scutellaria baicalensis root extract citric acid sodium benzoate camellia sinensis leaf extract licorice root extract chamomilla recutita flower extract rosemary leaf extract sodium metabisulfite
https://www.wardahbeauty.com/id/product/skincare/wardah-acnederm-night-treatment-moisturizer?ref=https://www.wardahbeauty.com/id/product/list/skincare/sort/acnederm?page=1,ACNEDERM NIGHT TREATMENT MOISTURIZER,"Malam hari merupakan waktu terbaik bagi kulit untuk memulihkan kondisi serta menyerap semua nutrisi penting yang dibutuhkan. Wardah Acnederm Night Treatment Moisturizer dengan 7 Extract Tumbuhan Alami tidak hanya mampu menutrisi kulit, namun juga menjaga hidrasi serta membantu mencerahkannya.","Salicylic Acid (BHA) untuk eksfoliasi dan mengatasi jerawat, serta formula 7 Natural Plant Extracts (termasuk Licorice, Centella Asiatica, dan Chamomile) untuk menenangkan, mencerahkan, dan menjaga kelembapan kulit berjerawat, plus Niacinamide untuk mencerahkan, membantu menjaga hidrasi kulit, dan melawan minyak berlebih di malam hari",malam hari merupakan waktu terbaik bagi kulit untuk memulihkan kondisi serta menyerap semua nutrisi penting yang dibutuhkan wardah acnederm night treatment moisturizer dengan extract tumbuhan alami tidak hanya mampu menutrisi kulit namun juga menjaga hidrasi serta membantu mencerahkannya,salicylic acid bha untuk eksfoliasi dan mengatasi jerawat serta formula natural plant extracts termasuk licorice centella asiatica dan chamomile untuk menenangkan mencerahkan dan menjaga kelembapan kulit berjerawat plus niacinamide untuk mencerahkan membantu menjaga hidrasi kulit dan melawan minyak berlebih di malam hari,acnederm night treatment moisturizer,"['treatment', 'moisturizer']","['acne-prone', 'all skin types', 'combination', 'dry', 'sensitive']",acnederm night treatment moisturizer treatment moisturizer acne-prone all skin types combination dry sensitive malam hari merupakan waktu terbaik bagi kulit untuk memulihkan kondisi serta menyerap semua nutrisi penting yang dibutuhkan wardah acnederm night treatment moisturizer dengan extract tumbuhan alami tidak hanya mampu menutrisi kulit namun juga menjaga hidrasi serta membantu mencerahkannya salicylic acid bha untuk eksfoliasi dan mengatasi jerawat serta formula natural plant extracts termasuk licorice centella asiatica dan chamomile untuk menenangkan mencerahkan dan menjaga kelembapan kulit berjerawat plus niacinamide untuk mencerahkan membantu menjaga hidrasi kulit dan melawan minyak berlebih di malam hari
https://www.wardahbeauty.com/id/product/skincare/wardah-acnederm-day-moisturizer?ref=https://www.wardahbeauty.com/id/product/list/skincare/sort/acnederm?page=1,ACNEDERM DAY MOISTURIZER,"Pelembab khusus untuk perawatan kulit yang rentan berjerawat, untuk menjaga hidrasi kulit sekaligus melindunginya dari sinar UV.","Witch Hazel Extract (oil control), Triclosan (mencegah jerawat), Pro-Vitamin B5 (Panthenol), Vitamin E (Tocopheryl Acetate), dan Aloe Vera Extract",pelembab khusus untuk perawatan kulit yang rentan berjerawat untuk menjaga hidrasi kulit sekaligus melindunginya dari sinar uv,witch hazel extract oil control triclosan mencegah jerawat pro vitamin b panthenol vitamin e tocopheryl acetate dan aloe vera extract,acnederm day moisturizer,['moisturizer'],"['dry', 'oily', 'sensitive']",acnederm day moisturizer moisturizer dry oily sensitive pelembab khusus untuk perawatan kulit yang rentan berjerawat untuk menjaga hidrasi kulit sekaligus melindunginya dari sinar uv witch hazel extract oil control triclosan mencegah jerawat pro vitamin b panthenol vitamin e tocopheryl acetate dan aloe vera extract
https://www.wardahbeauty.com/id/product/skincare/wardah-acnederm-pure-refining-toner?ref=https://www.wardahbeauty.com/id/product/list/skincare/sort/acnederm?page=1,ACNEDERM PURE REFINING TONER,Gunakan toner multifungsi yang dapat bantu meringkas pori-pori kulit setelah membersihkan wajah. Hasilnya kulit akan lebih mudah menyerap manfaat krim pelembab yang akan digunakan.,"Witch Hazel Extract, Aloe Vera Extract, Zinc Gluconate (Derma Tret Actives) untuk membantu meringkas pori, mengontrol minyak, menenangkan kulit berjerawat",gunakan toner multifungsi yang dapat bantu meringkas pori pori kulit setelah membersihkan wajah hasilnya kulit akan lebih mudah menyerap manfaat krim pelembab yang akan digunakan,witch hazel extract aloe vera extract zinc gluconate derma tret actives untuk membantu meringkas pori mengontrol minyak menenangkan kulit berjerawat,acnederm pure refining toner,['toner/essence'],"['dry', 'oily', 'sensitive']",acnederm pure refining toner toner/essence dry oily sensitive gunakan toner multifungsi yang dapat bantu meringkas pori pori kulit setelah membersihkan wajah hasilnya kulit akan lebih mudah menyerap manfaat krim pelembab yang akan digunakan witch hazel extract aloe vera extract zinc gluconate derma tret actives untuk membantu meringkas pori mengontrol minyak menenangkan kulit berjerawat
https://www.wardahbeauty.com/id/product/skincare/wardah-acnederm-pure-foaming-cleanser?ref=https://www.wardahbeauty.com/id/product/list/skincare/sort/acnederm?page=1,ACNEDERM PURE FOAMING CLEANSER,"Pembersih wajah tepat yang diformulasikan untuk bantu atasi masalah kulit berjerawat, mampu membersihkan debu, kotoran, dan minyak berlebih di wajah.","DERMACLEANSE ACTIVES, ALLANTOIN, ALOE VERA EXTRACT. Aqua, Sodium Laureth Sulfate, Cocamidopropyl Betaine, Propylene Glycol, Sodium Lauroyl Sarcosinate, Sodium Chloride, Decyl Glucoside,PEG-120 Methyl Glucose Dioleate, Acrylates Copolymer, PEG-3 Distearate,Zinc Gluconate, Salicylic Acid, DMDM Hydantoin, Fragrance, Triethanolamine,Allantoin, Disodium EDTA",pembersih wajah tepat yang diformulasikan untuk bantu atasi masalah kulit berjerawat mampu membersihkan debu kotoran dan minyak berlebih di wajah,dermacleanse actives allantoin aloe vera extract aqua sodium laureth sulfate cocamidopropyl betaine propylene glycol sodium lauroyl sarcosinate sodium chloride decyl glucoside peg methyl glucose dioleate acrylates copolymer peg distearate zinc gluconate salicylic acid dmdm hydantoin fragrance triethanolamine allantoin disodium edta,acnederm pure foaming cleanser,"['face wash', 'cleanser']","['acne-prone', 'dry', 'sensitive']",acnederm pure foaming cleanser face wash cleanser acne-prone dry sensitive pembersih wajah tepat yang diformulasikan untuk bantu atasi masalah kulit berjerawat mampu membersihkan debu kotoran dan minyak berlebih di wajah dermacleanse actives allantoin aloe vera extract aqua sodium laureth sulfate cocamidopropyl betaine propylene glycol sodium lauroyl sarcosinate sodium chloride decyl glucoside peg methyl glucose dioleate acrylates copolymer peg distearate zinc gluconate salicylic acid dmdm hydantoin fragrance triethanolamine allantoin disodium edta
https://www.wardahbeauty.com/id/product/skincare/acnederm-pore-blackhead-balm?ref=https://www.wardahbeauty.com/id/product/list/skincare/sort/acnederm?page=1,ACNEDERM PORE BLACKHEAD BALM,"Merupakan balm untuk kurangi komedo/blackhead di pori-pori wajah yang timbul akibat minyak berlebih, yang menumpuk di dalam pori kulit dan menghitam karena teroksidasi.","Mineral Oil (Paraffinum Liquidum), Salicylic Acid, dan Tea Tree Leaf Oil",merupakan balm untuk kurangi komedo blackhead di pori pori wajah yang timbul akibat minyak berlebih yang menumpuk di dalam pori kulit dan menghitam karena teroksidasi,mineral oil paraffinum liquidum salicylic acid dan tea tree leaf oil,acnederm pore blackhead balm,['cleanser'],['acne-prone'],acnederm pore blackhead balm cleanser acne-prone merupakan balm untuk kurangi komedo blackhead di pori pori wajah yang timbul akibat minyak berlebih yang menumpuk di dalam pori kulit dan menghitam karena teroksidasi mineral oil paraffinum liquidum salicylic acid dan tea tree leaf oil
https://www.wardahbeauty.com/id/product/skincare/crystal-secret-radiance-serum-mask?ref=https://www.wardahbeauty.com/id/product/list/skincare/sort/crystal-secret?page=1,CRYSTAL SECRET RADIANCE SERUM MASK,"Wardah Crystal Secret Radiance Serum Mask merupakan sheet mask dengan Alpha Arbutin + Allantoin yang membantu untuk: Menjadikan kulit tampak cerah sebening kristal Menyamarkan noda hitam dan bekas jerawat Merawat kekuatan skin barrier 100% terbuat dari bahan natural dan degradable lyocell fiber, cocok untuk semua jenis kulit dengan permasalahan noda hitam, bekas jerawat, skin barrier, dan kulit kusam","Alpha Arbutin + 100% Edelweiss Extract + Vitamin B3: membantu skin-lightening effect, dan memberikan perfect skin sensation Other Ingredients: Allantoin, Glycerin",wardah crystal secret radiance serum mask merupakan sheet mask dengan alpha arbutin allantoin yang membantu untuk menjadikan kulit tampak cerah sebening kristal menyamarkan noda hitam dan bekas jerawat merawat kekuatan skin barrier terbuat dari bahan natural dan degradable lyocell fiber cocok untuk semua jenis kulit dengan permasalahan noda hitam bekas jerawat skin barrier dan kulit kusam,alpha arbutin edelweiss extract vitamin b membantu skin lightening effect dan memberikan perfect skin sensation other ingredients allantoin glycerin,crystal secret radiance serum mask,"['mask', 'serum']","['all skin types', 'combination']",crystal secret radiance serum mask mask serum all skin types combination wardah crystal secret radiance serum mask merupakan sheet mask dengan alpha arbutin allantoin yang membantu untuk menjadikan kulit tampak cerah sebening kristal menyamarkan noda hitam dan bekas jerawat merawat kekuatan skin barrier terbuat dari bahan natural dan degradable lyocell fiber cocok untuk semua jenis kulit dengan permasalahan noda hitam bekas jerawat skin barrier dan kulit kusam alpha arbutin edelweiss extract vitamin b membantu skin lightening effect dan memberikan perfect skin sensation other ingredients allantoin glycerin
https://www.wardahbeauty.com/id/product/skincare/crystal-secret-micellar-cleansing-gel?ref=https://www.wardahbeauty.com/id/product/list/skincare/sort/crystal-secret?page=1,CRYSTAL SECRET MICELLAR CLEANSING GEL,"Micellar gel yang bersihkan kulit dan menyegarkan, cocok untuk kulit normal berminyak. First cleanser dengan tekstur gel dan sustainable moist beads untuk membersihkan wajah secara menyeluruh dengan sensasi tetap lembab. Diperkaya Natural AHA + PHA untuk mengangkat sel kulit mati, kulit terasa lebih bersih, halus, dan tampak cerah sebening kristal.","Natural AHA+PHA untuk eksfoliasi lembut, Edelweiss Extract untuk mencerahkan, dan formula Whitening Complex (termasuk Alpha Arbutin, Licorice Extract, & Vitamin B3) untuk meratakan warna kulit, serta pelembap seperti Vitamin E, Pro Vitamin B5, dan Hyaluronic Acid",micellar gel yang bersihkan kulit dan menyegarkan cocok untuk kulit normal berminyak first cleanser dengan tekstur gel dan sustainable moist beads untuk membersihkan wajah secara menyeluruh dengan sensasi tetap lembab diperkaya natural aha pha untuk mengangkat sel kulit mati kulit terasa lebih bersih halus dan tampak cerah sebening kristal,natural aha pha untuk eksfoliasi lembut edelweiss extract untuk mencerahkan dan formula whitening complex termasuk alpha arbutin licorice extract vitamin b untuk meratakan warna kulit serta pelembap seperti vitamin e pro vitamin b dan hyaluronic acid,crystal secret micellar cleansing gel,['cleanser'],"['all skin types', 'combination', 'dry']",crystal secret micellar cleansing gel cleanser all skin types combination dry micellar gel yang bersihkan kulit dan menyegarkan cocok untuk kulit normal berminyak first cleanser dengan tekstur gel dan sustainable moist beads untuk membersihkan wajah secara menyeluruh dengan sensasi tetap lembab diperkaya natural aha pha untuk mengangkat sel kulit mati kulit terasa lebih bersih halus dan tampak cerah sebening kristal natural aha pha untuk eksfoliasi lembut edelweiss extract untuk mencerahkan dan formula whitening complex termasuk alpha arbutin licorice extract vitamin b untuk meratakan warna kulit serta pelembap seperti vitamin e pro vitamin b dan hyaluronic acid
https://www.wardahbeauty.com/id/product/skincare/crystal-secret-refreshing-day-gel?ref=https://www.wardahbeauty.com/id/product/list/skincare/sort/crystal-secret?page=1,CRYSTAL SECRET REFRESHING DAY GEL,"Day gel dengan tekstur gel ringan untuk mencerahkan, menghidrasi, dan melindungi kulit dari sinar UVA/UVB dengan SPF 35 PA+++. Cocok untuk kulit normal - oily. Mengandung Alpha Arbutin yang dapat meratakan warna kulit & cerahkan noda hitam bekas jerawat, Niacinamide yang secara aktif mampu mengurangi tampilan kulit kusam, serta Edelweiss Extract, menyempurnakan kecerahan kulit di tiap lapisan.","Alpha Arbutin dan Niacinamide untuk mencerahkan dan meratakan warna kulit, Edelweiss Extract untuk melindungi dari kusam, serta mengandung SPF 35 PA+++ untuk perlindungan UV, dengan tekstur gel ringan yang menyegarkan dan menghidrasi, serta mengandung bahan seperti Aqua, Glycerin, dan formula yang menyegarkan",day gel dengan tekstur gel ringan untuk mencerahkan menghidrasi dan melindungi kulit dari sinar uva uvb dengan spf pa cocok untuk kulit normal oily mengandung alpha arbutin yang dapat meratakan warna kulit cerahkan noda hitam bekas jerawat niacinamide yang secara aktif mampu mengurangi tampilan kulit kusam serta edelweiss extract menyempurnakan kecerahan kulit di tiap lapisan,alpha arbutin dan niacinamide untuk mencerahkan dan meratakan warna kulit edelweiss extract untuk melindungi dari kusam serta mengandung spf pa untuk perlindungan uv dengan tekstur gel ringan yang menyegarkan dan menghidrasi serta mengandung bahan seperti aqua glycerin dan formula yang menyegarkan,crystal secret refreshing day gel,['moisturizer'],"['all skin types', 'combination']",crystal secret refreshing day gel moisturizer all skin types combination day gel dengan tekstur gel ringan untuk mencerahkan menghidrasi dan melindungi kulit dari sinar uva uvb dengan spf pa cocok untuk kulit normal oily mengandung alpha arbutin yang dapat meratakan warna kulit cerahkan noda hitam bekas jerawat niacinamide yang secara aktif mampu mengurangi tampilan kulit kusam serta edelweiss extract menyempurnakan kecerahan kulit di tiap lapisan alpha arbutin dan niacinamide untuk mencerahkan dan meratakan warna kulit edelweiss extract untuk melindungi dari kusam serta mengandung spf pa untuk perlindungan uv dengan tekstur gel ringan yang menyegarkan dan menghidrasi serta mengandung bahan seperti aqua glycerin dan formula yang menyegarkan
https://www.wardahbeauty.com/id/product/skincare/crystal-secret-bright-peptide-5-niacinamide-hyperpigmentation-expert-night-moisturizer?ref=https://www.wardahbeauty.com/id/product/list/skincare/sort/crystal-secret?page=1,CRYSTAL SECRET BRIGHT PEPTIDE + 5% NIACINAMIDE HYPERPIGMENTATION EXPERT NIGHT MOISTURIZER,"Krim malam yang mengandung kombinasi Bright Peptide dan 5% Niacinamide untuk menutrisi, mencerahkan, dan meratakan warna kulit untuk kulit tampak lebih cerah sebening kristal.","Alpha Arbutin, 5% Niacinamide (Vitamin B3), dan Brightening Peptide untuk mencerahkan, meratakan warna kulit, menyamarkan noda hitam, serta menutrisi kulit di malam hari, ditambah bahan pelembap seperti Hyaluronic Acid, Vitamin E, dan Pro-Vitamin B5, dengan AHA Natural untuk eksfoliasi ringan, membantu kulit lebih halus dan cerah sebening kristal",krim malam yang mengandung kombinasi bright peptide dan niacinamide untuk menutrisi mencerahkan dan meratakan warna kulit untuk kulit tampak lebih cerah sebening kristal,alpha arbutin niacinamide vitamin b dan brightening peptide untuk mencerahkan meratakan warna kulit menyamarkan noda hitam serta menutrisi kulit di malam hari ditambah bahan pelembap seperti hyaluronic acid vitamin e dan pro vitamin b dengan aha natural untuk eksfoliasi ringan membantu kulit lebih halus dan cerah sebening kristal,crystal secret bright peptide 5% niacinamide hyperpigmentation expert night moisturizer,['moisturizer'],"['all skin types', 'combination', 'dry']",crystal secret bright peptide 5% niacinamide hyperpigmentation expert night moisturizer moisturizer all skin types combination dry krim malam yang mengandung kombinasi bright peptide dan niacinamide untuk menutrisi mencerahkan dan meratakan warna kulit untuk kulit tampak lebih cerah sebening kristal alpha arbutin niacinamide vitamin b dan brightening peptide untuk mencerahkan meratakan warna kulit menyamarkan noda hitam serta menutrisi kulit di malam hari ditambah bahan pelembap seperti hyaluronic acid vitamin e dan pro vitamin b dengan aha natural untuk eksfoliasi ringan membantu kulit lebih halus dan cerah sebening kristal
