url,name,about,ingredients,clean_about,clean_ingredients,clean_name,category,skin_type,combined_text
https://www.wardahbeauty.com/id/product/skincare/uv-shield-aqua-fresh-sunscreen-serum-spf-50-pa?ref=https://www.wardahbeauty.com/id/product/list/skincare/sort/uv-shield-series?page=1,UV SHIELD AQUA FRESH SUNSCREEN SERUM SPF 50 PA++++,"Wardah UV Shield Aqua Fresh Essence SPF 50 PA++++, sunscreen dengan Broad Spectrum Protection, 50x lebih optimal* menjaga kulit dari sinar UV A / UV B, serta pancaran blue light berlebih. Dengan inovasi formula 0% alkohol namun tetap ringan dan tidak lengket, serta Aquafused Technology di dalamnya yang menjadikan sunscreen terasa segar seperti air dan terus menerus menghidrasi kulit.","0% Alcohol, Broad Spectrum Protection, Aquafused Technology, Bisabolol. Aqua, Ethylhexyl Methoxycinnamate, Ethylhexyl Salicylate, Homosalate, Butyl Methoxydibenzoylmethane, Octocrylene, Polymethyl Methacrylate, Butylene Glycol, Butyloctyl Salicylate, Bis-Ethylhexyloxyphenol Methoxyphenyl Triazine, Cyclopentasiloxane, Polyurethene-79, Arachidyl Alcohol, Polyester-7, Behenyl Alcohol, Bisabolol, Nylon-12, Phenoxyethanol,, Polyacrylate Crosspolymer-6, Caprylic/Capric Triglycerides, Neopentyl Glycol Diheptanoate, Chlorphenesin, Arachidyl Glucoside, Propanediol, Polyacrylate-13, Disodium EDTA, Fragrance, Polyisobutene, Pongamia Glabra Seed Oil, Polysorbate 20 , Artemisia Capillaris Flower Extract.",wardah uv shield aqua fresh essence spf pa sunscreen dengan broad spectrum protection x lebih optimal menjaga kulit dari sinar uv a uv b serta pancaran blue light berlebih dengan inovasi formula alkohol namun tetap ringan dan tidak lengket serta aquafused technology di dalamnya yang menjadikan sunscreen terasa segar seperti air dan terus menerus menghidrasi kulit,alcohol broad spectrum protection aquafused technology bisabolol aqua ethylhexyl methoxycinnamate ethylhexyl salicylate homosalate butyl methoxydibenzoylmethane octocrylene polymethyl methacrylate butylene glycol butyloctyl salicylate bis ethylhexyloxyphenol methoxyphenyl triazine cyclopentasiloxane polyurethene arachidyl alcohol polyester behenyl alcohol bisabolol nylon phenoxyethanol polyacrylate crosspolymer caprylic capric triglycerides neopentyl glycol diheptanoate chlorphenesin arachidyl glucoside propanediol polyacrylate disodium edta fragrance polyisobutene pongamia glabra seed oil polysorbate artemisia capillaris flower extract,uv shield aqua fresh sunscreen serum spf 50 pa,"['serum', 'sunscreen']","['all skin types', 'combination', 'oily', 'sensitive']",uv shield aqua fresh sunscreen serum spf 50 pa serum sunscreen all skin types combination oily sensitive wardah uv shield aqua fresh essence spf pa sunscreen dengan broad spectrum protection x lebih optimal menjaga kulit dari sinar uv a uv b serta pancaran blue light berlebih dengan inovasi formula alkohol namun tetap ringan dan tidak lengket serta aquafused technology di dalamnya yang menjadikan sunscreen terasa segar seperti air dan terus menerus menghidrasi kulit alcohol broad spectrum protection aquafused technology bisabolol aqua ethylhexyl methoxycinnamate ethylhexyl salicylate homosalate butyl methoxydibenzoylmethane octocrylene polymethyl methacrylate butylene glycol butyloctyl salicylate bis ethylhexyloxyphenol methoxyphenyl triazine cyclopentasiloxane polyurethene arachidyl alcohol polyester behenyl alcohol bisabolol nylon phenoxyethanol polyacrylate crosspolymer caprylic capric triglycerides neopentyl glycol diheptanoate chlorphenesin arachidyl glucoside propanediol polyacrylate disodium edta fragrance polyisobutene pongamia glabra seed oil polysorbate artemisia capillaris flower extract
https://www.wardahbeauty.com/id/product/skincare/wardah-hydra-rose-nmf-amino-pentavitin-barrier-replenish-ph-5-5-gel-cleanser?ref=https://www.wardahbeauty.com/id/product/list/skincare/sort/hydra-rose?page=1,"WARDAH HYDRA ROSE NMF AMINO + PENTAVITIN BARRIER REPLENISH PH 5,5 GEL CLEANSER",Hydrating foam dengan NMF Amino + Pentavitin yang membersihkan secara gentle sehingga menjadikan kulit sehat dan skin barrier terjaga,NMF Amino Menjaga keseimbangan Acid Mantle dan berikan perlindungan lebih untuk kulit Pentavitin Menghidrasi kulit,hydrating foam dengan nmf amino pentavitin yang membersihkan secara gentle sehingga menjadikan kulit sehat dan skin barrier terjaga,nmf amino menjaga keseimbangan acid mantle dan berikan perlindungan lebih untuk kulit pentavitin menghidrasi kulit,wardah hydra rose nmf amino pentavitin barrier replenish ph 5 5 gel cleanser,"['face wash', 'cleanser']","['dry', 'sensitive']",wardah hydra rose nmf amino pentavitin barrier replenish ph 5 5 gel cleanser face wash cleanser dry sensitive hydrating foam dengan nmf amino pentavitin yang membersihkan secara gentle sehingga menjadikan kulit sehat dan skin barrier terjaga nmf amino menjaga keseimbangan acid mantle dan berikan perlindungan lebih untuk kulit pentavitin menghidrasi kulit
https://www.wardahbeauty.com/id/product/skincare/wardah-hydra-rose-moisture-rich-night-gel?ref=https://www.wardahbeauty.com/id/product/list/skincare/sort/hydra-rose?page=1,HYDRA ROSE MOISTURE RICH NIGHT GEL,"Wardah Hydra Rose Moisture Rich Night Gel, pelembap dengan tekstur gel kaya nutrisi mengandung 72 Hours Hydrating Active dan Rose Oil yang memiliki efek antioksidan dan menghidrasi serta menjaga kelembapan kulit. Diformulasikan khusus dengan Stress Relief Agent untuk melawan efek stres dari lingkungan yang terakumulasi seharian dengan meningkatkan kemampuan lapisan kulit dalam menjaga hidrasi. Mengandung Active Penetration Booster (Lecigel): membantu bahan aktif masuk ke dalam lapisan kulit lebih banyak sehingga memberikan efek yang lebih optimal.","72 HOURS HYDRATING ACTIVE (PENTAVITIN), ROSE OIL ACTIVE, PENETRATION BOOSTER (LECIGEL), TRIPLE ANTIOXIDANT STRESS RELIEF AGENT (NATURAL-BISABOLOL), ALCOHOL FREE. Aqua, Glycerin, Cetearyl Ethylhexanoate, Cyclopentasiloxane, Dimethicone, Sodium Acrylates Copolymer, Pentylene Glycol, Saccharide Isomerate, Phenoxyethanol, Bisabolol, Lecithin, Glyceryl Stearate, Brassica Campestris (Rapeseed) Seed Oil, Tocopheryl Acetate, Chlorphenesin, PEG-100 Stearate, Disodium EDTA, Dimethicone/Vinyl Dimethicone Crosspolymer, Amodimethicone, Carbomer, Sodium Hydroxide, Rose Extract, Citric Acid, Sodium Citrate, Fragrance, Trideceth-9, Tocopherol, PEG-40 Hydrogenated Castor Oil, Ethylhexylglycerin, Polysorbate 20, CI 19140, CI 17200.",wardah hydra rose moisture rich night gel pelembap dengan tekstur gel kaya nutrisi mengandung hours hydrating active dan rose oil yang memiliki efek antioksidan dan menghidrasi serta menjaga kelembapan kulit diformulasikan khusus dengan stress relief agent untuk melawan efek stres dari lingkungan yang terakumulasi seharian dengan meningkatkan kemampuan lapisan kulit dalam menjaga hidrasi mengandung active penetration booster lecigel membantu bahan aktif masuk ke dalam lapisan kulit lebih banyak sehingga memberikan efek yang lebih optimal,hours hydrating active pentavitin rose oil active penetration booster lecigel triple antioxidant stress relief agent natural bisabolol alcohol free aqua glycerin cetearyl ethylhexanoate cyclopentasiloxane dimethicone sodium acrylates copolymer pentylene glycol saccharide isomerate phenoxyethanol bisabolol lecithin glyceryl stearate brassica campestris rapeseed seed oil tocopheryl acetate chlorphenesin peg stearate disodium edta dimethicone vinyl dimethicone crosspolymer amodimethicone carbomer sodium hydroxide rose extract citric acid sodium citrate fragrance trideceth tocopherol peg hydrogenated castor oil ethylhexylglycerin polysorbate ci ci,hydra rose moisture rich night gel,['moisturizer'],"['all skin types', 'combination', 'dry']",hydra rose moisture rich night gel moisturizer all skin types combination dry wardah hydra rose moisture rich night gel pelembap dengan tekstur gel kaya nutrisi mengandung hours hydrating active dan rose oil yang memiliki efek antioksidan dan menghidrasi serta menjaga kelembapan kulit diformulasikan khusus dengan stress relief agent untuk melawan efek stres dari lingkungan yang terakumulasi seharian dengan meningkatkan kemampuan lapisan kulit dalam menjaga hidrasi mengandung active penetration booster lecigel membantu bahan aktif masuk ke dalam lapisan kulit lebih banyak sehingga memberikan efek yang lebih optimal hours hydrating active pentavitin rose oil active penetration booster lecigel triple antioxidant stress relief agent natural bisabolol alcohol free aqua glycerin cetearyl ethylhexanoate cyclopentasiloxane dimethicone sodium acrylates copolymer pentylene glycol saccharide isomerate phenoxyethanol bisabolol lecithin glyceryl stearate brassica campestris rapeseed seed oil tocopheryl acetate chlorphenesin peg stearate disodium edta dimethicone vinyl dimethicone crosspolymer amodimethicone carbomer sodium hydroxide rose extract citric acid sodium citrate fragrance trideceth tocopherol peg hydrogenated castor oil ethylhexylglycerin polysorbate ci ci
https://www.wardahbeauty.com/id/product/skincare/wardah-hydra-rose-dewy-aqua-day-gel?ref=https://www.wardahbeauty.com/id/product/list/skincare/sort/hydra-rose?page=1,HYDRA ROSE DEWY AQUA DAY GEL,"Wardah Hydra Rose Dewy Aqua Day Gel, pelembap dengan tekstur gel ringan dan watery mengandung 72 Hours Hydrating Active dan Rose Oil yang menghidrasi serta menjaga kelembapan kulit. Diperkaya dengan Bio-Hyaluronic Acid yang melapisi permukaan kulit, bekerja ekstra menjaganya tetap terhidrasi sepanjang hari.","72 HOURS HYDRATING ACTIVE (PENTAVITIN), ROSE OIL, BIO-HYALURONIC ACID (BIO-HA), ALCOHOL FREE. Aqua, Glycerin, Cyclopentasiloxane, Triheptanoin, Butylene Glycol, Trehalose, Biosaccharide Gum-1, Dimethicone, Beta-Glucan, Ammonium Acryloyldimethyltaurate/VP Copolymer, Saccharide Isomerate, Bisabolol, Brassica Campestris (Rapeseed) Seed Oil, Polyglyceryl-3 Methylglucose Distearate, Phenoxyethanol, Polysorbate 20, Carbomer, Disodium EDTA, Chlorphenesin, Silica, Tocopheryl Acetate, Potassium Hydroxide, Sodium Hyaluronate, Dimethicone/Vinyl Dimethicone Crosspolymer, Pentylene Glycol, Rose Extract, Propanediol, Amodimethicone, Sodium Hydroxide, Fragrance, Citric Acid, Sodium Citrate, PEG-32, Diazolidinyl Urea, Tocopherol, Trideceth-9, PEG-40 Hydrogenated Castor Oil, Ethylhexylglycerin, CI 17200, CI 19140.",wardah hydra rose dewy aqua day gel pelembap dengan tekstur gel ringan dan watery mengandung hours hydrating active dan rose oil yang menghidrasi serta menjaga kelembapan kulit diperkaya dengan bio hyaluronic acid yang melapisi permukaan kulit bekerja ekstra menjaganya tetap terhidrasi sepanjang hari,hours hydrating active pentavitin rose oil bio hyaluronic acid bio ha alcohol free aqua glycerin cyclopentasiloxane triheptanoin butylene glycol trehalose biosaccharide gum dimethicone beta glucan ammonium acryloyldimethyltaurate vp copolymer saccharide isomerate bisabolol brassica campestris rapeseed seed oil polyglyceryl methylglucose distearate phenoxyethanol polysorbate carbomer disodium edta chlorphenesin silica tocopheryl acetate potassium hydroxide sodium hyaluronate dimethicone vinyl dimethicone crosspolymer pentylene glycol rose extract propanediol amodimethicone sodium hydroxide fragrance citric acid sodium citrate peg diazolidinyl urea tocopherol trideceth peg hydrogenated castor oil ethylhexylglycerin ci ci,hydra rose dewy aqua day gel,['moisturizer'],['dry'],hydra rose dewy aqua day gel moisturizer dry wardah hydra rose dewy aqua day gel pelembap dengan tekstur gel ringan dan watery mengandung hours hydrating active dan rose oil yang menghidrasi serta menjaga kelembapan kulit diperkaya dengan bio hyaluronic acid yang melapisi permukaan kulit bekerja ekstra menjaganya tetap terhidrasi sepanjang hari hours hydrating active pentavitin rose oil bio hyaluronic acid bio ha alcohol free aqua glycerin cyclopentasiloxane triheptanoin butylene glycol trehalose biosaccharide gum dimethicone beta glucan ammonium acryloyldimethyltaurate vp copolymer saccharide isomerate bisabolol brassica campestris rapeseed seed oil polyglyceryl methylglucose distearate phenoxyethanol polysorbate carbomer disodium edta chlorphenesin silica tocopheryl acetate potassium hydroxide sodium hyaluronate dimethicone vinyl dimethicone crosspolymer pentylene glycol rose extract propanediol amodimethicone sodium hydroxide fragrance citric acid sodium citrate peg diazolidinyl urea tocopherol trideceth peg hydrogenated castor oil ethylhexylglycerin ci ci
https://www.wardahbeauty.com/id/product/skincare/hydra-rose-14x-hyaluron-pentavitin-deep-barrier-repair-serum?ref=https://www.wardahbeauty.com/id/product/list/skincare/sort/hydra-rose?page=1,HYDRA ROSE 14X HYALURON + PENTAVITIN DEEP BARRIER REPAIR SERUM,"Serum dengan kandungan 72 Hours Hydrating Active dan Rose Oil menghidrasi serta menjaga kelembapan kulit. Diperkaya butiran HydraMoist Micro Gel, gel lembut yang melebur ke setiap lapisan kulit terdalam memberikan kelembapan ekstra sepanjang hari.",72 HOURS HYDRATING ACTIVE (PENTAVITIN) ROSE OIL HYDRA MOIST MICRO GEL REHYDRATION AND PROTECTOR ACTIVE (TREHALOSE) ALCOHOL FREE,serum dengan kandungan hours hydrating active dan rose oil menghidrasi serta menjaga kelembapan kulit diperkaya butiran hydramoist micro gel gel lembut yang melebur ke setiap lapisan kulit terdalam memberikan kelembapan ekstra sepanjang hari,hours hydrating active pentavitin rose oil hydra moist micro gel rehydration and protector active trehalose alcohol free,hydra rose 14x hyaluron pentavitin deep barrier repair serum,['serum'],['dry'],hydra rose 14x hyaluron pentavitin deep barrier repair serum serum dry serum dengan kandungan hours hydrating active dan rose oil menghidrasi serta menjaga kelembapan kulit diperkaya butiran hydramoist micro gel gel lembut yang melebur ke setiap lapisan kulit terdalam memberikan kelembapan ekstra sepanjang hari hours hydrating active pentavitin rose oil hydra moist micro gel rehydration and protector active trehalose alcohol free
https://www.wardahbeauty.com/id/product/skincare/wardah-hydra-rose-petal-infused-toner?ref=https://www.wardahbeauty.com/id/product/list/skincare/sort/hydra-rose?page=1,HYDRA ROSE PETAL INFUSED TONER,"Toner dengan kelopak bunga mawar asli serta 72 Hours Hydrating Active di dalamnya bekerja dengan mengembalikan skin barrier yang rusak, menenangkan serta mengembalikan hidrasi/kelembaban optimal kulit wajah agar siap menyerap nutrisi dari produk skin care yang digunakan selanjutnya, dan menjaga kelembaban kulit hingga 72 jam.",72 HOURS HYDRATING ACTIVE (PENTAVITIN) PETAL BUNGA MAWAR ASLI & AIR MAWAR MURNI ALLANTOIN ALCOHOL FREE FRAGRANCE FREE,toner dengan kelopak bunga mawar asli serta hours hydrating active di dalamnya bekerja dengan mengembalikan skin barrier yang rusak menenangkan serta mengembalikan hidrasi kelembaban optimal kulit wajah agar siap menyerap nutrisi dari produk skin care yang digunakan selanjutnya dan menjaga kelembaban kulit hingga jam,hours hydrating active pentavitin petal bunga mawar asli air mawar murni allantoin alcohol free fragrance free,hydra rose petal infused toner,['toner/essence'],"['dry', 'sensitive']",hydra rose petal infused toner toner/essence dry sensitive toner dengan kelopak bunga mawar asli serta hours hydrating active di dalamnya bekerja dengan mengembalikan skin barrier yang rusak menenangkan serta mengembalikan hidrasi kelembaban optimal kulit wajah agar siap menyerap nutrisi dari produk skin care yang digunakan selanjutnya dan menjaga kelembaban kulit hingga jam hours hydrating active pentavitin petal bunga mawar asli air mawar murni allantoin alcohol free fragrance free
https://www.wardahbeauty.com/id/product/skincare/wardah-hydra-rose-gel-to-foam-cleanser?ref=https://www.wardahbeauty.com/id/product/list/skincare/sort/hydra-rose?page=1,HYDRA ROSE GEL-TO-FOAM CLEANSER,"Mild foaming facial wash dengan tekstur gel yang lembut serta kandungan 72 Hours Hydrating Active membantu melembabkan kulit secara maksimal dan Rose Oil sebagai antioksidan dan memberikan efek soothing serta mampu membersihkan wajah dari debu, minyak, kotoran, dan sisa make-up tanpa membuat kulit terasa kering setelah dibilas. Serta mambuat kulit terasa lebih halus dan lembut dengan Smoothing Active. Kulit bersih namun tetap terjaga kelembabannya.",72 HOURS HYDRATING ACTIVE (PENTAVITIN) ROSE OIL ALCOHOL FREE,mild foaming facial wash dengan tekstur gel yang lembut serta kandungan hours hydrating active membantu melembabkan kulit secara maksimal dan rose oil sebagai antioksidan dan memberikan efek soothing serta mampu membersihkan wajah dari debu minyak kotoran dan sisa make up tanpa membuat kulit terasa kering setelah dibilas serta mambuat kulit terasa lebih halus dan lembut dengan smoothing active kulit bersih namun tetap terjaga kelembabannya,hours hydrating active pentavitin rose oil alcohol free,hydra rose gel to foam cleanser,"['face wash', 'cleanser']","['dry', 'sensitive']",hydra rose gel to foam cleanser face wash cleanser dry sensitive mild foaming facial wash dengan tekstur gel yang lembut serta kandungan hours hydrating active membantu melembabkan kulit secara maksimal dan rose oil sebagai antioksidan dan memberikan efek soothing serta mampu membersihkan wajah dari debu minyak kotoran dan sisa make up tanpa membuat kulit terasa kering setelah dibilas serta mambuat kulit terasa lebih halus dan lembut dengan smoothing active kulit bersih namun tetap terjaga kelembabannya hours hydrating active pentavitin rose oil alcohol free
https://www.wardahbeauty.com/id/product/skincare/wardah-renew-you-nmf-amino-ceramide-rejuvenating-gel-to-foam-cleanser?ref=https://www.wardahbeauty.com/id/product/list/skincare/sort/renew-you?page=1,WARDAH RENEW YOU NMF AMINO + CERAMIDE REJUVENATING GEL TO FOAM CLEANSER,Gentle cleanser dengan NMF Amino + Ceramide membersihkan secara menyeluruh dengan lembut dan menjadikan kulit lebih halus & kenyal.,NMF Amino Menjaga keseimbangan Acid Mantle dan berikan perlindungan lebih untuk kulit Ceramide Menjaga kelembapan kulit,gentle cleanser dengan nmf amino ceramide membersihkan secara menyeluruh dengan lembut dan menjadikan kulit lebih halus kenyal,nmf amino menjaga keseimbangan acid mantle dan berikan perlindungan lebih untuk kulit ceramide menjaga kelembapan kulit,wardah renew you nmf amino ceramide rejuvenating gel to foam cleanser,"['face wash', 'cleanser']","['dry', 'sensitive']",wardah renew you nmf amino ceramide rejuvenating gel to foam cleanser face wash cleanser dry sensitive gentle cleanser dengan nmf amino ceramide membersihkan secara menyeluruh dengan lembut dan menjadikan kulit lebih halus kenyal nmf amino menjaga keseimbangan acid mantle dan berikan perlindungan lebih untuk kulit ceramide menjaga kelembapan kulit
https://www.wardahbeauty.com/id/product/skincare/wardah-renew-you-anti-aging-eye-cream?ref=https://www.wardahbeauty.com/id/product/list/skincare/sort/renew-you?page=1,RENEW YOU ANTI AGING EYE CREAM,"Eye Cream dengan formula yang lembut dan cepat menyerap, nyaman digunakan untuk merawat kulit di area sekitar mata, mengandung Peptide Matrixyl™ dan Bakuchiol, formulanya bantu menyamarkan kantung mata dari pemakaian pertama (instant blurring formula), teruji secara klinis dapat menyamarkan kerutan dan garis halus, membuat kulit terasa kencang, dan menghaluskan tekstur kulit di area mata secara signifikan dalam 4 minggu pemakaian*. Dilengkapi dengan Niacinamide yang mencerahkan dan Bisabolol yang menenangkan area kulit di sekitar mata.","Bakuchiol: membantu mengurangi tampilan kerutan dan garis halus Peptide Matrixyl™: menjaga produksi kolagen untuk kulit kencang, elastis, dengan kerutan tersamarkan Niacinamide: meratakan warna kulit, mencerahkan kulit kusam Bisabolol: menenangkan area kulit di sekitar mata Adipoless: mengurangi tampilan lingkaran hitam pada area sekitar mata Instant Blurring Formula: seketika menyamarkan kantung mata dan lingkar hitam (dark circle) di area mata , serta menghaluskan tekstur kulit",eye cream dengan formula yang lembut dan cepat menyerap nyaman digunakan untuk merawat kulit di area sekitar mata mengandung peptide matrixyl dan bakuchiol formulanya bantu menyamarkan kantung mata dari pemakaian pertama instant blurring formula teruji secara klinis dapat menyamarkan kerutan dan garis halus membuat kulit terasa kencang dan menghaluskan tekstur kulit di area mata secara signifikan dalam minggu pemakaian dilengkapi dengan niacinamide yang mencerahkan dan bisabolol yang menenangkan area kulit di sekitar mata,bakuchiol membantu mengurangi tampilan kerutan dan garis halus peptide matrixyl menjaga produksi kolagen untuk kulit kencang elastis dengan kerutan tersamarkan niacinamide meratakan warna kulit mencerahkan kulit kusam bisabolol menenangkan area kulit di sekitar mata adipoless mengurangi tampilan lingkaran hitam pada area sekitar mata instant blurring formula seketika menyamarkan kantung mata dan lingkar hitam dark circle di area mata serta menghaluskan tekstur kulit,renew you anti aging eye cream,['eye cream'],['all skin types'],renew you anti aging eye cream eye cream all skin types eye cream dengan formula yang lembut dan cepat menyerap nyaman digunakan untuk merawat kulit di area sekitar mata mengandung peptide matrixyl dan bakuchiol formulanya bantu menyamarkan kantung mata dari pemakaian pertama instant blurring formula teruji secara klinis dapat menyamarkan kerutan dan garis halus membuat kulit terasa kencang dan menghaluskan tekstur kulit di area mata secara signifikan dalam minggu pemakaian dilengkapi dengan niacinamide yang mencerahkan dan bisabolol yang menenangkan area kulit di sekitar mata bakuchiol membantu mengurangi tampilan kerutan dan garis halus peptide matrixyl menjaga produksi kolagen untuk kulit kencang elastis dengan kerutan tersamarkan niacinamide meratakan warna kulit mencerahkan kulit kusam bisabolol menenangkan area kulit di sekitar mata adipoless mengurangi tampilan lingkaran hitam pada area sekitar mata instant blurring formula seketika menyamarkan kantung mata dan lingkar hitam dark circle di area mata serta menghaluskan tekstur kulit
https://www.wardahbeauty.com/id/product/skincare/renew-you-1-retinol-microcapsule-ceramide-cell-renewal-serum?ref=https://www.wardahbeauty.com/id/product/list/skincare/sort/renew-you?page=1,RENEW YOU 1% RETINOL MICROCAPSULE + CERAMIDE CELL RENEWAL SERUM,"Intensive serum yang diformulasikan oleh skin expert dengan kombinasi bahan aktif terbaik untuk membantu merawat proses regenerasi alamiah sel kulit baru. Setiap tetesnya mengandung 1% Microcapsule Retinol yang diformulasikan dalam microcapsule untuk penetrasi lebih dalam namun tetap terasa lembut di kulit karena dilengkapi teknologi slow release, Bakuchiol yang membuat formula lebih efektif meregenerasi namun terasa gentle, 3% Ceramide yang memastikan kulit tetap sehat dengan skin barrier yang terjaga, dan 5% Niacinamide yang powerful namun gentle untuk kulit terasa kencang, cerah, halus, dengan pori dan garis halus tersamarkan.","Bakuchiol: membantu mengurangi tampilan kerutan dan garis halus 1% Microcapsule Retinol: retinol dengan teknologi slow release untuk mengurangi kerutan, garis halus, mengencangkan kulit 3% Ceramide: memperkuat skin barrier agar tetap sehat dan meningkatkan level kelembapan kulit 5% Niacinamide: meratakan warna kulit, mencerahkan kulit kusam Peptide Matrixyl™: menjaga produksi kolagen untuk kulit kencang, elastis, dengan kerutan tersamarkan",intensive serum yang diformulasikan oleh skin expert dengan kombinasi bahan aktif terbaik untuk membantu merawat proses regenerasi alamiah sel kulit baru setiap tetesnya mengandung microcapsule retinol yang diformulasikan dalam microcapsule untuk penetrasi lebih dalam namun tetap terasa lembut di kulit karena dilengkapi teknologi slow release bakuchiol yang membuat formula lebih efektif meregenerasi namun terasa gentle ceramide yang memastikan kulit tetap sehat dengan skin barrier yang terjaga dan niacinamide yang powerful namun gentle untuk kulit terasa kencang cerah halus dengan pori dan garis halus tersamarkan,bakuchiol membantu mengurangi tampilan kerutan dan garis halus microcapsule retinol retinol dengan teknologi slow release untuk mengurangi kerutan garis halus mengencangkan kulit ceramide memperkuat skin barrier agar tetap sehat dan meningkatkan level kelembapan kulit niacinamide meratakan warna kulit mencerahkan kulit kusam peptide matrixyl menjaga produksi kolagen untuk kulit kencang elastis dengan kerutan tersamarkan,renew you 1% retinol microcapsule ceramide cell renewal serum,['serum'],"['all skin types', 'combination', 'dry', 'sensitive']",renew you 1% retinol microcapsule ceramide cell renewal serum serum all skin types combination dry sensitive intensive serum yang diformulasikan oleh skin expert dengan kombinasi bahan aktif terbaik untuk membantu merawat proses regenerasi alamiah sel kulit baru setiap tetesnya mengandung microcapsule retinol yang diformulasikan dalam microcapsule untuk penetrasi lebih dalam namun tetap terasa lembut di kulit karena dilengkapi teknologi slow release bakuchiol yang membuat formula lebih efektif meregenerasi namun terasa gentle ceramide yang memastikan kulit tetap sehat dengan skin barrier yang terjaga dan niacinamide yang powerful namun gentle untuk kulit terasa kencang cerah halus dengan pori dan garis halus tersamarkan bakuchiol membantu mengurangi tampilan kerutan dan garis halus microcapsule retinol retinol dengan teknologi slow release untuk mengurangi kerutan garis halus mengencangkan kulit ceramide memperkuat skin barrier agar tetap sehat dan meningkatkan level kelembapan kulit niacinamide meratakan warna kulit mencerahkan kulit kusam peptide matrixyl menjaga produksi kolagen untuk kulit kencang elastis dengan kerutan tersamarkan
