url,name,about,ingredients,clean_about,clean_ingredients,clean_name,category,skin_type,combined_text
https://www.wardahbeauty.com/id/product/skincare/calm-and-soothe-gel-moisturizer?ref=https://www.wardahbeauty.com/id/product/list/skincare/sort/gel-moisturizer?page=1,CALM AND SOOTHE GEL MOISTURIZER,"Moisturizer dengan format gel yang watery, ringan dan nyaman untuk berbagai permasalahan kulitmu. Dilengkapi 3 holistic actions yang bekerja secara sinergis rebuild, repair, dan regenerate skin barrier untuk kulit sehat dan glowing.","2% Cica Complex Meredakan kemerahan 0,5% Panthenol dan 1% Ceramide Menjaga kesehatan skin barrier. 0,5% Allantoin Menenangkan kulit yang kemerahan dan iritasi. 5% B3 Niacinamide Bantu mencerahkan noda bekas jerawat",moisturizer dengan format gel yang watery ringan dan nyaman untuk berbagai permasalahan kulitmu dilengkapi holistic actions yang bekerja secara sinergis rebuild repair dan regenerate skin barrier untuk kulit sehat dan glowing,cica complex meredakan kemerahan panthenol dan ceramide menjaga kesehatan skin barrier allantoin menenangkan kulit yang kemerahan dan iritasi b niacinamide bantu mencerahkan noda bekas jerawat,calm and soothe gel moisturizer,['moisturizer'],"['all skin types', 'combination', 'dry', 'sensitive']",calm and soothe gel moisturizer moisturizer all skin types combination dry sensitive moisturizer dengan format gel yang watery ringan dan nyaman untuk berbagai permasalahan kulitmu dilengkapi holistic actions yang bekerja secara sinergis rebuild repair dan regenerate skin barrier untuk kulit sehat dan glowing cica complex meredakan kemerahan panthenol dan ceramide menjaga kesehatan skin barrier allantoin menenangkan kulit yang kemerahan dan iritasi b niacinamide bantu mencerahkan noda bekas jerawat
https://www.wardahbeauty.com/id/product/skincare/nature-daily-aloe-seaweed-micellar-water?ref=https://www.wardahbeauty.com/id/product/list/skincare/sort/nature-daily?page=1,NATURE DAILY ALOE SEAWEED MICELLAR WATER,"Wardah Nature Daily Aloe Seaweed Micellar Water dengan 3 powerful actions membersihkan kulit hingga ke pori-pori dengan lembut, meredakan kemerahan, serta menguatkan skin barrier. Dilengkapi 3X Skin Barrier Agent berikan 20% instant hydration saat bersihkan wajah dari make up dan kotoran.","ALLANTOIN + BIOSACCHARIDE + PANTHENOL Meningkatkan kekuatan skin barrier ALOE + SEAWEED Menghidrasi kulit dan Meredakan kemerahan. Ekstrak Lidah Buaya (Aloe Barbadensis Leaf Extract) dan Ekstrak Rumput Laut (Ulva Lactuca Extract) untuk menenangkan dan melembapkan, serta Niacinamide untuk mencerahkan, Panthenol dan Allantoin untuk menyejukkan, dan Glycerin sebagai pelembap, diformulasikan dengan formula pembersihan lembut bebas alkohol untuk membersihkan makeup dan kotoran hingga pori-pori.",wardah nature daily aloe seaweed micellar water dengan powerful actions membersihkan kulit hingga ke pori pori dengan lembut meredakan kemerahan serta menguatkan skin barrier dilengkapi x skin barrier agent berikan instant hydration saat bersihkan wajah dari make up dan kotoran,allantoin biosaccharide panthenol meningkatkan kekuatan skin barrier aloe seaweed menghidrasi kulit dan meredakan kemerahan ekstrak lidah buaya aloe barbadensis leaf extract dan ekstrak rumput laut ulva lactuca extract untuk menenangkan dan melembapkan serta niacinamide untuk mencerahkan panthenol dan allantoin untuk menyejukkan dan glycerin sebagai pelembap diformulasikan dengan formula pembersihan lembut bebas alkohol untuk membersihkan makeup dan kotoran hingga pori pori,nature daily aloe seaweed micellar water,['cleanser'],"['all skin types', 'combination', 'dry', 'sensitive']",nature daily aloe seaweed micellar water cleanser all skin types combination dry sensitive wardah nature daily aloe seaweed micellar water dengan powerful actions membersihkan kulit hingga ke pori pori dengan lembut meredakan kemerahan serta menguatkan skin barrier dilengkapi x skin barrier agent berikan instant hydration saat bersihkan wajah dari make up dan kotoran allantoin biosaccharide panthenol meningkatkan kekuatan skin barrier aloe seaweed menghidrasi kulit dan meredakan kemerahan ekstrak lidah buaya aloe barbadensis leaf extract dan ekstrak rumput laut ulva lactuca extract untuk menenangkan dan melembapkan serta niacinamide untuk mencerahkan panthenol dan allantoin untuk menyejukkan dan glycerin sebagai pelembap diformulasikan dengan formula pembersihan lembut bebas alkohol untuk membersihkan makeup dan kotoran hingga pori pori
https://www.wardahbeauty.com/id/product/skincare/nature-daily-hydramild-toner-essence?ref=https://www.wardahbeauty.com/id/product/list/skincare/sort/nature-daily?page=1,NATURE DAILY HYDRAMILD TONER ESSENCE,"Nature Daily Hydramild Toner Essence merupakan 5 in 1 produk yang diformulasikan dengan pH balance yang bisa digunakan sebagai toner, essence, face mask, eye mas, dan face mist. Mengandung ekstrak 100% aloe vera untuk melembabkan dan menyegarkan kulit. Terdapat juga kandungan allantoin untuk menenangkan dan melembutkan kulit.","Natural Aloe Vera Extract untuk melembapkan dan menenangkan kulit, serta Allantoin untuk melembutkan, diformulasikan dengan pH balance sebagai kombinasi toner dan essence untuk hidrasi ekstra, cocok untuk semua jenis kulit. Kandungan penting lainnya termasuk Glycerin, Sodium Hyaluronate, dan Hamamelis Virginiana (Witch Hazel) leaf extract",nature daily hydramild toner essence merupakan in produk yang diformulasikan dengan ph balance yang bisa digunakan sebagai toner essence face mask eye mas dan face mist mengandung ekstrak aloe vera untuk melembabkan dan menyegarkan kulit terdapat juga kandungan allantoin untuk menenangkan dan melembutkan kulit,natural aloe vera extract untuk melembapkan dan menenangkan kulit serta allantoin untuk melembutkan diformulasikan dengan ph balance sebagai kombinasi toner dan essence untuk hidrasi ekstra cocok untuk semua jenis kulit kandungan penting lainnya termasuk glycerin sodium hyaluronate dan hamamelis virginiana witch hazel leaf extract,nature daily hydramild toner essence,"['mask', 'toner/essence']","['dry', 'sensitive']",nature daily hydramild toner essence mask toner/essence dry sensitive nature daily hydramild toner essence merupakan in produk yang diformulasikan dengan ph balance yang bisa digunakan sebagai toner essence face mask eye mas dan face mist mengandung ekstrak aloe vera untuk melembabkan dan menyegarkan kulit terdapat juga kandungan allantoin untuk menenangkan dan melembutkan kulit natural aloe vera extract untuk melembapkan dan menenangkan kulit serta allantoin untuk melembutkan diformulasikan dengan ph balance sebagai kombinasi toner dan essence untuk hidrasi ekstra cocok untuk semua jenis kulit kandungan penting lainnya termasuk glycerin sodium hyaluronate dan hamamelis virginiana witch hazel leaf extract
https://www.wardahbeauty.com/id/product/skincare/wardah-nature-daily-capsule-mask?ref=https://www.wardahbeauty.com/id/product/list/skincare/sort/nature-daily?page=1,NATURE DAILY CAPSULE MASK,"Wardah Nature Daily Capsule Mask, 5 varian masker wajah yang dikemas dalam bentuk kapsul, mudah digunakan dan praktis untuk dibawa bepergian. Kini kamu bisa memilih berbagai jenis dan fungsi masker sesuai dengan kebutuhan kulitmu di waktu tertentu! - Tea Tree untuk menyerap minyak dan membersihkan pori - Orange Pomelo untuk mencerahkan wajah - Alpine Apple untuk merawat tekstur kulit wajah - Amazonian Acai Berry untuk menjaga kulit dari polusi dan radikal bebas - Milky Oat untuk mengangkat sel kulit mati","Aqua, Kaolin, Bentonite, PVP, Titanium Dioxide, Glycerin, Mineral Oil (Paraffinum Liquidum), Cellulose Gum, Polysorbate 60, Sodium Lauryl Sulfate, DMDM Hydantoin, Citric Acid, Melaleuca Alternifolia (Tea Tree) Leaf Oil, Fragrance, Disodium EDTA, Epilobium Angustifolium Flower/Leaf/Stem Extract, Tocopheryl Acetate, Phenoxyethanol, Sodium Metabisulfite, Trideceth-9, PEG-40 Hydrogenated Castor Oil , Ethylhexylglycerin, Polysorbate 20",wardah nature daily capsule mask varian masker wajah yang dikemas dalam bentuk kapsul mudah digunakan dan praktis untuk dibawa bepergian kini kamu bisa memilih berbagai jenis dan fungsi masker sesuai dengan kebutuhan kulitmu di waktu tertentu tea tree untuk menyerap minyak dan membersihkan pori orange pomelo untuk mencerahkan wajah alpine apple untuk merawat tekstur kulit wajah amazonian acai berry untuk menjaga kulit dari polusi dan radikal bebas milky oat untuk mengangkat sel kulit mati,aqua kaolin bentonite pvp titanium dioxide glycerin mineral oil paraffinum liquidum cellulose gum polysorbate sodium lauryl sulfate dmdm hydantoin citric acid melaleuca alternifolia tea tree leaf oil fragrance disodium edta epilobium angustifolium flower leaf stem extract tocopheryl acetate phenoxyethanol sodium metabisulfite trideceth peg hydrogenated castor oil ethylhexylglycerin polysorbate,nature daily capsule mask,['mask'],['acne-prone'],nature daily capsule mask mask acne-prone wardah nature daily capsule mask varian masker wajah yang dikemas dalam bentuk kapsul mudah digunakan dan praktis untuk dibawa bepergian kini kamu bisa memilih berbagai jenis dan fungsi masker sesuai dengan kebutuhan kulitmu di waktu tertentu tea tree untuk menyerap minyak dan membersihkan pori orange pomelo untuk mencerahkan wajah alpine apple untuk merawat tekstur kulit wajah amazonian acai berry untuk menjaga kulit dari polusi dan radikal bebas milky oat untuk mengangkat sel kulit mati aqua kaolin bentonite pvp titanium dioxide glycerin mineral oil paraffinum liquidum cellulose gum polysorbate sodium lauryl sulfate dmdm hydantoin citric acid melaleuca alternifolia tea tree leaf oil fragrance disodium edta epilobium angustifolium flower leaf stem extract tocopheryl acetate phenoxyethanol sodium metabisulfite trideceth peg hydrogenated castor oil ethylhexylglycerin polysorbate
https://www.wardahbeauty.com/id/product/skincare/wardah-nature-daily-mineral--clarifying-clay-mask?ref=https://www.wardahbeauty.com/id/product/list/skincare/sort/nature-daily?page=1,NATURE DAILY MINERAL+ CLARIFYING CLAY MASK,"Masker clay perawatan wajah yang mengandung CarboActiv Formula yang mampu menyerap polutan dan Clarifying Mineral+ (mineral alami) yang terdiri atas akolin dan bentonite dengan kemampuan detoksifikasi kulit dari toksin, bakteri, serta kemampuan menyerap minyak berlebih dari permukaan kulit yang sangat baik.","CARBOACTIV FORMULA, MINERAL ALAMI (KAOLIN DAN BENTONITE). Aqua, Kaolin, Bentonite, PVP, Glycerin, Titanium Dioxide, Cellulose Gum, Mineral Oil (Paraffinum Liquidum), Polysorbate 60, DMDM Hydantoin, Sodium Lauryl Sulfate, Fragrance, Charcoal Powder, Butylene Glycol, Hamamelis Virginiana (Witch Hazel) Leaf Extract, Caprae Lac Extract, Maltodextrine, Propylene Glycol, Aloe Barbadensis (Aloe Vera) Leaf Extract, Potassium Sorbate, Sodium Benzoate, Ulva Lactuca Extract, Glycerin, Tocopheryl Acetate, CI 77499.",masker clay perawatan wajah yang mengandung carboactiv formula yang mampu menyerap polutan dan clarifying mineral mineral alami yang terdiri atas akolin dan bentonite dengan kemampuan detoksifikasi kulit dari toksin bakteri serta kemampuan menyerap minyak berlebih dari permukaan kulit yang sangat baik,carboactiv formula mineral alami kaolin dan bentonite aqua kaolin bentonite pvp glycerin titanium dioxide cellulose gum mineral oil paraffinum liquidum polysorbate dmdm hydantoin sodium lauryl sulfate fragrance charcoal powder butylene glycol hamamelis virginiana witch hazel leaf extract caprae lac extract maltodextrine propylene glycol aloe barbadensis aloe vera leaf extract potassium sorbate sodium benzoate ulva lactuca extract glycerin tocopheryl acetate ci,nature daily mineral clarifying clay mask,['mask'],"['dry', 'oily', 'sensitive']",nature daily mineral clarifying clay mask mask dry oily sensitive masker clay perawatan wajah yang mengandung carboactiv formula yang mampu menyerap polutan dan clarifying mineral mineral alami yang terdiri atas akolin dan bentonite dengan kemampuan detoksifikasi kulit dari toksin bakteri serta kemampuan menyerap minyak berlebih dari permukaan kulit yang sangat baik carboactiv formula mineral alami kaolin dan bentonite aqua kaolin bentonite pvp glycerin titanium dioxide cellulose gum mineral oil paraffinum liquidum polysorbate dmdm hydantoin sodium lauryl sulfate fragrance charcoal powder butylene glycol hamamelis virginiana witch hazel leaf extract caprae lac extract maltodextrine propylene glycol aloe barbadensis aloe vera leaf extract potassium sorbate sodium benzoate ulva lactuca extract glycerin tocopheryl acetate ci
https://www.wardahbeauty.com/id/product/skincare/wardah-nature-daily-mineral--facial-foam?ref=https://www.wardahbeauty.com/id/product/list/skincare/sort/nature-daily?page=1,NATURE DAILY MINERAL+ FACIAL FOAM,"Mengandung CarboActiv dan Clarifying Mineral+ yang bersihkan debu, polusi, dan minyak berlebih secara tuntas, yang sesuai dengan kegiatan outdoormu yang terpapar sinar matahari dan poulsi udara","Myristic Acid, Glycerin, Aqua, Butylene Glycol, Stearic Acid, Potassium Hydroxide, serta formula khusus CarboActiv (karbon aktif) dan Clarifying Mineral+ yang membantu membersihkan debu, polusi, dan minyak berlebih, dengan tambahan Niacinamide dan Silica",mengandung carboactiv dan clarifying mineral yang bersihkan debu polusi dan minyak berlebih secara tuntas yang sesuai dengan kegiatan outdoormu yang terpapar sinar matahari dan poulsi udara,myristic acid glycerin aqua butylene glycol stearic acid potassium hydroxide serta formula khusus carboactiv karbon aktif dan clarifying mineral yang membantu membersihkan debu polusi dan minyak berlebih dengan tambahan niacinamide dan silica,nature daily mineral facial foam,['face wash'],"['all skin types', 'combination']",nature daily mineral facial foam face wash all skin types combination mengandung carboactiv dan clarifying mineral yang bersihkan debu polusi dan minyak berlebih secara tuntas yang sesuai dengan kegiatan outdoormu yang terpapar sinar matahari dan poulsi udara myristic acid glycerin aqua butylene glycol stearic acid potassium hydroxide serta formula khusus carboactiv karbon aktif dan clarifying mineral yang membantu membersihkan debu polusi dan minyak berlebih dengan tambahan niacinamide dan silica
https://www.wardahbeauty.com/id/product/skincare/wardah-nature-daily-aloe-hydramild-moisturizer-cream?ref=https://www.wardahbeauty.com/id/product/list/skincare/sort/nature-daily?page=1,NATURE DAILY ALOE HYDRAMILD MOISTURIZER CREAM,"Krim pelembab dengan formula pH balance yang dibutuhkan setiap jenis kulit. Mengandung Olive oil dan Vitamin E yang menutrisi lapisan-lapisan kulit, juga dilengkapi vitamin E sebagai antioksidan.","Aloe Barbadensis (Aloe Vera) Leaf Extract untuk menenangkan, Glycerin sebagai pelembap, serta Olive Oil dan Vitamin E untuk nutrisi, dengan formula pH balance, emolien (Dimethicone, Cetearyl Alcohol), dan pengemulsi (Glyceryl Stearate, PEG-100 Stearate) untuk menjaga kelembapan optimal kuli",krim pelembab dengan formula ph balance yang dibutuhkan setiap jenis kulit mengandung olive oil dan vitamin e yang menutrisi lapisan lapisan kulit juga dilengkapi vitamin e sebagai antioksidan,aloe barbadensis aloe vera leaf extract untuk menenangkan glycerin sebagai pelembap serta olive oil dan vitamin e untuk nutrisi dengan formula ph balance emolien dimethicone cetearyl alcohol dan pengemulsi glyceryl stearate peg stearate untuk menjaga kelembapan optimal kuli,nature daily aloe hydramild moisturizer cream,['moisturizer'],"['dry', 'sensitive']",nature daily aloe hydramild moisturizer cream moisturizer dry sensitive krim pelembab dengan formula ph balance yang dibutuhkan setiap jenis kulit mengandung olive oil dan vitamin e yang menutrisi lapisan lapisan kulit juga dilengkapi vitamin e sebagai antioksidan aloe barbadensis aloe vera leaf extract untuk menenangkan glycerin sebagai pelembap serta olive oil dan vitamin e untuk nutrisi dengan formula ph balance emolien dimethicone cetearyl alcohol dan pengemulsi glyceryl stearate peg stearate untuk menjaga kelembapan optimal kuli
https://www.wardahbeauty.com/id/product/skincare/wardah-nature-daily-aloe-hydramild-serum?ref=https://www.wardahbeauty.com/id/product/list/skincare/sort/nature-daily?page=1,NATURE DAILY ALOE HYDRAMILD SERUM,Serum berkonsentrasi tinggi mengandung ekstrak Aloe Vera sebagai soothing agent yang dikombinasikan dengan Hyaluronic Acid dapat membentuk sumber kelembaban untuk membantu proses hidrasi kulit agar dapat berjalan optimal serta menambah kekenyalan dan kesegaran kulit. Mengandung Vitamin E untuk membantu melindungi kulit dari radikal bebas. Secara intensif memberikan hasil nyata bagi kulit normal-kering.,"HYDRAMILD ALOE VERA EXTRACT, MOISTURIZING DUO, OLIVE OIL. Aqua, Cetearyl Alcohol, Dimethicone, Glycerin, Isopropyl Myristate, Glyceryl Stearate, Ceteareth-33, PEG-100 Stearate, Phenoxyethanol, Propylene Glycol, Titanium Dioxide, Aloe Barbadensis (Aloe Vera) Leaf Extract, Fragrance, PEG-20 Stearate, Olive Oil PEG-7 Ester, Triethylene Glycol, Potassium Sorbate, Sodium Benzoate",serum berkonsentrasi tinggi mengandung ekstrak aloe vera sebagai soothing agent yang dikombinasikan dengan hyaluronic acid dapat membentuk sumber kelembaban untuk membantu proses hidrasi kulit agar dapat berjalan optimal serta menambah kekenyalan dan kesegaran kulit mengandung vitamin e untuk membantu melindungi kulit dari radikal bebas secara intensif memberikan hasil nyata bagi kulit normal kering,hydramild aloe vera extract moisturizing duo olive oil aqua cetearyl alcohol dimethicone glycerin isopropyl myristate glyceryl stearate ceteareth peg stearate phenoxyethanol propylene glycol titanium dioxide aloe barbadensis aloe vera leaf extract fragrance peg stearate olive oil peg ester triethylene glycol potassium sorbate sodium benzoate,nature daily aloe hydramild serum,['serum'],"['dry', 'sensitive']",nature daily aloe hydramild serum serum dry sensitive serum berkonsentrasi tinggi mengandung ekstrak aloe vera sebagai soothing agent yang dikombinasikan dengan hyaluronic acid dapat membentuk sumber kelembaban untuk membantu proses hidrasi kulit agar dapat berjalan optimal serta menambah kekenyalan dan kesegaran kulit mengandung vitamin e untuk membantu melindungi kulit dari radikal bebas secara intensif memberikan hasil nyata bagi kulit normal kering hydramild aloe vera extract moisturizing duo olive oil aqua cetearyl alcohol dimethicone glycerin isopropyl myristate glyceryl stearate ceteareth peg stearate phenoxyethanol propylene glycol titanium dioxide aloe barbadensis aloe vera leaf extract fragrance peg stearate olive oil peg ester triethylene glycol potassium sorbate sodium benzoate
https://www.wardahbeauty.com/id/product/skincare/wardah-nature-daily-aloe-hydramild-facial-wash?ref=https://www.wardahbeauty.com/id/product/list/skincare/sort/nature-daily?page=1,NATURE DAILY ALOE HYDRAMILD FACIAL WASH,"Pembersih wajah yang membersihkan kulit secara lembut merata dengan busa dan wangi yang ringan. Kini diformulasikan dengan Advanced Dermaclear+ Formula, Triple Hydrating Complex, Hydramild Aloe Vera Extract agar kulit wajah bersih, segar dan tetap terasa lembab.","Hydramild Aloe Vera Extract untuk menenangkan dan melembapkan, Triple Hydrating Complex untuk kelembapan ekstra, serta formula Advanced DermaClear+ dari asam amino untuk membersihkan minyak dan kotoran hingga pori-pori tanpa membuat kering. Glycerin, Cocamidopropyl Betaine, Propylene Glycol, dan bahan pengawet seperti Potassium Sorbate dan Sodium Benzoate",pembersih wajah yang membersihkan kulit secara lembut merata dengan busa dan wangi yang ringan kini diformulasikan dengan advanced dermaclear formula triple hydrating complex hydramild aloe vera extract agar kulit wajah bersih segar dan tetap terasa lembab,hydramild aloe vera extract untuk menenangkan dan melembapkan triple hydrating complex untuk kelembapan ekstra serta formula advanced dermaclear dari asam amino untuk membersihkan minyak dan kotoran hingga pori pori tanpa membuat kering glycerin cocamidopropyl betaine propylene glycol dan bahan pengawet seperti potassium sorbate dan sodium benzoate,nature daily aloe hydramild facial wash,['face wash'],"['all skin types', 'combination', 'dry', 'sensitive']",nature daily aloe hydramild facial wash face wash all skin types combination dry sensitive pembersih wajah yang membersihkan kulit secara lembut merata dengan busa dan wangi yang ringan kini diformulasikan dengan advanced dermaclear formula triple hydrating complex hydramild aloe vera extract agar kulit wajah bersih segar dan tetap terasa lembab hydramild aloe vera extract untuk menenangkan dan melembapkan triple hydrating complex untuk kelembapan ekstra serta formula advanced dermaclear dari asam amino untuk membersihkan minyak dan kotoran hingga pori pori tanpa membuat kering glycerin cocamidopropyl betaine propylene glycol dan bahan pengawet seperti potassium sorbate dan sodium benzoate
https://www.wardahbeauty.com/id/product/skincare/lightening-oil-infused-micellar-water?ref=https://www.wardahbeauty.com/id/product/list/skincare/sort/lightening?page=1,LIGHTENING OIL-INFUSED MICELLAR WATER,"Lightening Oil-Infused Micellar Water diformulasikan oleh para ahli lokal dan global, bersihkan hingga 99% makeup waterproof dengan Dual Phase Formula yang mengkombinasikan Micellar, Advanced Niacinamide, dan Pure Botanical Oils. Mampu bersihkan wajah dan make up dengan mudah dan menyeluruh sekaligus mencerahkan, menutrisi dan melembapkan kulit, tanpa rasa berminyak. Kulit bersih, cerah dan lembap!","Pure Botanical Oils: terdiri atas Macadamia Oil, Soybean Oil, Avocado Oil, Jojoba Oil, Chamomile Extract Micellar Technology: Mengangkat kotoran dan makeup di wajah Advanced Niacinamide: Mencerahkan dan menyeimbangkan kadar sebum Allantoin: Menenangkan kulit dan mencegah inflamasi",lightening oil infused micellar water diformulasikan oleh para ahli lokal dan global bersihkan hingga makeup waterproof dengan dual phase formula yang mengkombinasikan micellar advanced niacinamide dan pure botanical oils mampu bersihkan wajah dan make up dengan mudah dan menyeluruh sekaligus mencerahkan menutrisi dan melembapkan kulit tanpa rasa berminyak kulit bersih cerah dan lembap,pure botanical oils terdiri atas macadamia oil soybean oil avocado oil jojoba oil chamomile extract micellar technology mengangkat kotoran dan makeup di wajah advanced niacinamide mencerahkan dan menyeimbangkan kadar sebum allantoin menenangkan kulit dan mencegah inflamasi,lightening oil infused micellar water,['cleanser'],"['all skin types', 'combination', 'oily']",lightening oil infused micellar water cleanser all skin types combination oily lightening oil infused micellar water diformulasikan oleh para ahli lokal dan global bersihkan hingga makeup waterproof dengan dual phase formula yang mengkombinasikan micellar advanced niacinamide dan pure botanical oils mampu bersihkan wajah dan make up dengan mudah dan menyeluruh sekaligus mencerahkan menutrisi dan melembapkan kulit tanpa rasa berminyak kulit bersih cerah dan lembap pure botanical oils terdiri atas macadamia oil soybean oil avocado oil jojoba oil chamomile extract micellar technology mengangkat kotoran dan makeup di wajah advanced niacinamide mencerahkan dan menyeimbangkan kadar sebum allantoin menenangkan kulit dan mencegah inflamasi
https://www.wardahbeauty.com/id/product/skincare/wardah-lightening-face-mist?ref=https://www.wardahbeauty.com/id/product/list/skincare/sort/lightening?page=1,LIGHTENING FACE MIST,"Wardah Lightening Face Mist, 3-in-1 mist untuk primer make up, setting spray, dan refresh kulit dengan Advanced Niacinamide yang mencerahkan & melindungi dari efek negatif blue light. Diformulasikan khusus untuk bantu menjaga tampilan make-up lebih tahan lama. Cocok untuk semua jenis kulit.","Niacinamide (Advanced Niacinamide) untuk mencerahkan dan melindungi dari blue light, serta Glycyrrhiza Glabra (Licorice) Root Extract untuk pencerah alami, didukung oleh bahan pelembap dan pembentuk lapisan seperti Glycerin, Propanediol, PVP, dan formula pendukung lainnya seperti Allantoin, PEG-40 Hydrogenated Castor Oil, serta pewangi (Fragrance",wardah lightening face mist in mist untuk primer make up setting spray dan refresh kulit dengan advanced niacinamide yang mencerahkan melindungi dari efek negatif blue light diformulasikan khusus untuk bantu menjaga tampilan make up lebih tahan lama cocok untuk semua jenis kulit,niacinamide advanced niacinamide untuk mencerahkan dan melindungi dari blue light serta glycyrrhiza glabra licorice root extract untuk pencerah alami didukung oleh bahan pelembap dan pembentuk lapisan seperti glycerin propanediol pvp dan formula pendukung lainnya seperti allantoin peg hydrogenated castor oil serta pewangi fragrance,lightening face mist,['toner/essence'],"['all skin types', 'combination']",lightening face mist toner/essence all skin types combination wardah lightening face mist in mist untuk primer make up setting spray dan refresh kulit dengan advanced niacinamide yang mencerahkan melindungi dari efek negatif blue light diformulasikan khusus untuk bantu menjaga tampilan make up lebih tahan lama cocok untuk semua jenis kulit niacinamide advanced niacinamide untuk mencerahkan dan melindungi dari blue light serta glycyrrhiza glabra licorice root extract untuk pencerah alami didukung oleh bahan pelembap dan pembentuk lapisan seperti glycerin propanediol pvp dan formula pendukung lainnya seperti allantoin peg hydrogenated castor oil serta pewangi fragrance
